És un exercici brillant de periodisme d'investigació ―no és fàcil retratar la complexitat empresarial que maquilla i amaga les intencions dels delinqüents― i manté una intriga liderada pel magistrat interpretat per un esplèndid Vincent Lindon.,"un dramón. La gran Amy Adams és, com sempre la reina, aquí té de comparsa la no menys gran Glenn Close a qui ha pentinat i maquillat el seu pitjor enemic. La versemblança pot patinar per una caracterització com aquesta. Llums i ombres en aquesta"
L'Ana María va necessitar maquillar els traumes patits amb una capa embellidora.,"Bogarde, al paper d'un escriptor a les últimes. Assegut en una gandula a la platja del Lido, fins i tot amb tint al cabell i maquillat com un espantall, Aschenbach encarna la veritat despullada: ell ja és una ànima esgotada que descobreix en Tadzio, l'"
"La societat actual encara té molts mals, com l'edat mitjana, que heredem o inclús d'abans de l'edat mitjana, que els hem anat maquillant, hem anat evolucionant tecnològicament i socialment, però el rerefons és exactament el mateix.","Casado amb la mofa que ha generat veure com estava Pablo Casado. Un to ataronjat-groguenc, combinació de moreno i mal maquillat , que han estat la riota de la xarxa. Fixin-se en la imatge anterior: mirin com té la cara Casado i com té el coll: Casado"
"L'acusació contra la mandatària es basa en els anomenats pedalejos fiscals, una pràctica irregular prohibida per la llei de Responsabilitat Fiscal però que l'han feta servir habitualment tots els governants brasilers; aquesta pràctica consisteix a utilitzar avanços de diners de bancs públics per cobrir programes socials, maquillant el resultat pressupostari.","arribar a influir en les pacients. ""La clau és poder normalitzar la malaltia"", ha resumit Adsuara, ""en el meu cas no m'he maquillat en la meva vida, així que tampoc ho faré ara"", per això considera que tapar-se -amb un mocador o amb una perruca- no pot ser"
"Ara, per fi, el panorama és completament diferent i volen aprofitar les bones condicions per arribar fins a Setmana Santa amb una activitat normalitzada, que permeti maquillar els resultats d'aquest calorós hivern.","transporta al segle XVIII per conèixer el segon president dels Estats Units que no va tan pompós com els francesos, ni maquillat , però sí duia perruca i mocador al coll i teles brocades. Va haver-hi un moment en què els homes anaven tant o més guarnits"
Si el Partit Socialista passa hores baixes a Catalunya no serem nosaltres qui els maquillarem la seva situació.,". Què s'ha fet? ""No sóc de posar-me moltes coses a la cara, però des de fa temps, i ara mateix ho veureu, si vaig sense maquillar , tinc les ulleres negres i enfonsades"", diu Laura Fa, a través de les seves històries d'Instagram mentre va de camí a la"
"El Bembibre va poder maquillar el marcador en la recta final, (...)","amb aquests productes. Per això, compten amb pèls més llargs i espaiats. A més, la seva forma diagonal ajudarà a poder maquillar la zona seguint la forma natural del pòmul. Brotxa vento. El pinzell perfecte amb el qual usar l'il·luminador, per a"
"Més enllà que aquesta pràctica serveixi per maquillar estadístiques, cal tenir en compte que tots els vots computen per a consells comarcals i diputacions.","difondre propaganda electoral o realitzar actes de campanya. Marta Reyero, 56 anys, arriba tard i surt a T5 sense maquillar ni pentinar. Així El Filomena ha afectat totes les professions a mitja Espanya, també a les TV. Programes cancel·lats,"
"En definitiva, no es modifica realment la regulació de les mútues, sinó que exclusivament es maquilla a les mateixes perquè continuïn sent associacions d’empresaris “sense ànim de lucre” que persegueixen als treballadors malalts perquè no puguin percebre les prestacions de baixes mèdiques per malaltia comuna.","minuts explicant la nevada, entra al plató Marta Reyero de 56 anys, veterana de Cuatro. A correcuita, del carrer, sense maquillar ni pentinar, i en jersei de llana. Així: La presentadora agraeix al company d'esports i es posa a llegir el prompter que"
"L'objectiu, diuen, és elaborar una llista d'espera real, ja que denuncien que les xifres oficials estan maquillades.",", bona nena i innocent fins que la burxen, respon sense embuts a si s'ha punxat la cara: NO. Per demostrar-ho: foto sense maquillar . Aitana és meravellosa amb i sense maquillatge. La mascareta fa miracles, com que s'embruta de base i pintallavis, és"
"26. La segona part encara ha estat pitjor. Adán ha regalat un golàs. Yuri ha repetit des del punt de penal i Álex Vallejo ha maquillat el resultat en el minut 75, després d'aprofitar un rebuig. Bigas i Scepovic són les principals novetats del Mallorca","de base i pintallavis, és habitual que les noies de 21 anys no es maquillin per sota. I permet de veure Aitana sense maquillar . Natural i més esplèndida que a El hormiguero. Formigues són els que la critiquen. Aitana, un gegant. Avisa"
"superar davant els Rockets la barrera dels 10 punts (amb 8 ha empatat la seva marca anotadora més modesta), i només ha maquillat les seves estadístiques amb set rebots, tres assistències i un tap. En canvi, ha estat James Harden qui ha brillat en el","que a la segona planta de la Casa Prioral hi aniran dependències parroquials. Tamara Falcó com mai l'has vist. Sense maquillar , ni pentinar. No sembla ella Tamara Falcó està feliç, enamorada, contenta i se li nota. Tant, que si abans procurava"
"el tercer triomf consecutiu. Ha anotat només cinc de 17 tirs de camp, incloent-hi dos de nou intents de triples, però ha maquillat la seva aportació a l'aconseguir set punts de vuit llançaments des de la línia de personal. També ha estat el millor en","Covid-19 com a prioritat en el que resta de legislatura. Laura Matamoros com mai l'has vist: pel carrer en pijama i sense maquillar Cada vegada són més les famoses que aposten per la naturalitat a les seves fotos, fugint dels quilos de maquillatge i"
"no va incloure el bo com a deute corporatiu, decisió que ha provocat que al mercat hi hagi la por que l'empresa hagi maquillat els comptes per presentar un millor balanç. En relació amb aquest punt, l'agència de qualificació Fitch va emetre un",": ""Qué rara"" Cada vegada són més els famosos que s'uneixen a la tendència de fotografiar-se a les xarxes socials sense maquillar , per mostrar als seus seguidors el seu veritable rostre sense filtres. L'última en sumar-se a la moda viral ha estat l'"
"Sorhaindo ha culminat una posessió llarga. Entre Entreríos i Lazarov han ampliat l'avantatge fins que Víctor Vigo ha maquillat el marcador amb l'1 a 7. Els blaugrana han arribat al descans amb el 10 a 19. A la represa, els blaugrana han assolit la",encara més la mala maror quan no va acceptar una entrevista d'una periodista en una televisió local perquè anava maquillada i quan no voler parlar amb l'Associació de Veïns de l'Avinguda del Segre perquè estava presidida per una dona. Segon
al Granollers a la màxima diferència de 10 gols (21-31) a set minuts del final. En els darrers minuts els gallecs han maquillat una mica el resultat fins el 26-34. Un patinet elèctric atropella una nena de 7 anys a Barcelona Aquest dilluns s'han,"el mamarratxo, Vianor és sincer i na tural directa, espontani, sense gens d'amanerament ni d'afeetació. Molt poc maquillat , amb el seu rostre du na morenor avellutada i una perru ca estricta, en té prou per a donar la sensació picant i terbola,"
"temps ha acabat amb un contundent 4 a 19 i encara quedaven els vuit minuts finals, moment en què l'equip barceloní ha maquillat una mica el resultat, amb un gol més, i el Mataró ha sentenciat amb tres dianes que han tancat amb el 5 a 22 final. Les","per a la seua imatge externa, en la segona, estan preparades per a posar en pràctica els coneixements adquirits, maquillant-se elles mateixes, recolzades en tot moment pels consells de la professora. A les 16.30 hores d'esta mateixa vesprada, el"
"per arribar als 9 gols de marge (10-19), amb un altre gol a porta buida, aquest cop de Sorhaindo. Els castellans han maquillat una mica el resultat i s'ha arribat al descans amb el 13-20. En la segona meitat Pérez de Vargas ha sortit a la porteria del","i ets sents malament, fastiguejada... T'aixeques del llit, et poses la màscara i l'armadura pertinents, et maquilles . Surts de l'habitació i entres en el circ, en la pel·licula de la teva vida, tot és gris, t'has deixat les ulleres; tornes"
"res. Vaig en cadira, prenc pastilles pel dolor. Sóc diferent però sóc igual, tinc mil projectes i un cor gran. Jo no em maquillo , el meu món no és de cartró. Baix Llobregat Des de la Secció sindical de CGT de l'Hospital de Sant Joan de Déu de Martorell",i maquillatge. Aconsegueix un descompte de 5€ la nit del 29 d'octubre. Entrada gratuïta venint disfressat i maquillat . Zombificat! LOKO LEKTIVE @La CLUB Residents: PEPO WB & VICENTE BELENGUER Sala COLORS: LLUIS TORRALBO & MARCOS ALONSO
"improvisat. Representa que un vídeo porta a l'altre. Vam començar amb un ritual d'una tribu africana en que les noies es maquillaven per tal d'atreure possibles parelles, per passar a l'estrany i sobre-actuat tancament de la frontera entre el","fa, però també plorar, Fulvio Capitanio d'Units contra el Parkinson, em va dir, hores abans que anar a veure-la: - No et maquilles molt. Per això. Sobretot els que sabem d'EP. La pel•lícula esta en els cines del Centre Comercial la Marina d'Ondara i"
"mismo día un discurso en una sede sindical, desde donde se desplazó al plató de televisión, y una vez allí rechazó que le maquillaran . La imagen de Nixon fue la de un hombre cansado, con sudor en el rostro y bolsas bajo los ojos, especialmente marcadas por","rossos recollits en un elegant pentinat. Portava un vestit llarg fins als peus, blau marí, i era evident que anava maquillada , però el que més destacava eren els seus ulls verds. on tots els homes quedaven perduts. Aquella nit aquests quedaven"
"Sunçais que va tenir lloc a la fira Biocultura al Palau Sant Jordi de Barcelona el 4 de maig. Com a mestra de cerimònies, maquillada i pentinada amb tupé per l'ocasió, Valentina Thörner, l'autora del bloc Sostenibilidad y Minimalismo i del projecte",". Tot perquè se sentin a gust. Juguem amb el seu exterior, les seves versions i maneres de dir-les, les pentinem, les maquillem i els posem perruques. Les estimem a més no poder, i hi dormim abraçats: més d'una vegada he vist un membre de la família"
", produeix una bossade mà o un moneder únic i original. Descobrir la millor tècnica per treure bon profit a l'hora de maquillar-nos . Pràctica, barreja de colors, etc. Dimecres 9 de març, de 17.30 a 19 h Preu: 5 € -x XAPAR (xapes personalitzades)",Short Time perruques i maquillatge en maniquins té com objectiu principal mostrar les tècniques i els utensilis per a maquillar i pentinar maniquins i la seva correcta aplicació a l'aparadorisme i al comerç. Està dirigit a aquells professionals
"patir com a conseqüència de les obres i manteniment amb el vell tòpic del llarg temps d'espera que tarden les dones a maquillar-se , vestir-se... Entenem que el missatge que es desprèn d'aquest anunci és una nova mostra de masclisme que evidencia que","un descapotable pintant-se els llavis mirant-se en el retrovisor. De sobte, del cotxe comencen a eixir colorets per a maquillar-se a destall. La veu en off diu: ""Un coche hecho a nuestra medida""... Productes per a mantenir la lÃnia o d'estÃ ̈tica: Un"
"ja que només es van mostrar aquelles que l'ens municipal va decidir; i sense desglossar, per tant, dades irrefutables i maquillades . Un cop s'aprovin, s'obrirà un termini d'exposició pública i terminis per presentar al·legacions, tràmits que la CUP","de quedar amb l'opció fàcil. Aquesta mateixa tarda algunes estudiants de medicina agafen les seves millors gales, es maquillen i s'arreglen per anar a l'hospital. Unes grans ulleres, el cabell recollit en dues cues, una perruca acolorida, i per"
"partida que triplica les destinades a Cultura, Patrimoni i Ensenyament. · Rebutja les maniobres de comptabilitat que maquillen els pressupostos com ara que la desorbitada assignació de 530.000 d'euros a la Societat Anònima que gestiona el Nàstic",. * Observació. * Prendre consciència d'artistes. * Mostrar-se actiu davant d'una dificultat superable. * Aprendre a maquillar-se amb elements senzills. * Gaudir davant les actuacions en viu. * Mostrar respecte durant l'espectacle. * Reconèixer la
"de Serveis es presentin de manera conjunta, ja que ""només serveix per crear confusió amb dades contradictòries i maquillar el suspens dels ciutadans al Govern municipal"". Tant CiU com el PP han destacat de les enquestes que el 42,5% dels","de portadejar-lo , més d'agrair serà la de colofonitzar-lo amb la joia funerària de liquidar una tasca amb l'exhibició maquillada i elegant del cadàver exquisit -substantiu i qualificatiu que he tret d'algun clot dels soterranis de la memòria, ho"
"va fer el Vic- els mataronins només en van fer quatre. El matx ja sentenciat (72-34 al final del tercer quart) es va poder maquillar en un darrer període on el Vic va baixar la guàrdia i els mataronins van retallar 13 punts, insuficient per emportar-se","Mercat d'Idees de Disseny del BCD . (Sempre havia pensat que quan hagués de sortir a la tele aniria a la perruqueria, em maquillaria per l'ocasió, faria un esforç especial per oferir la meva millor cara.) Després de la roda de premsa, que vam superar amb"
"de nombroses obres neogòtiques que fessin més atractiu un barri que estava arraconat. Així doncs, el Barri Gòtic es va maquillar a finals del segle XIX i principis del XX en un intent primerenc de projectar una imatge internacional i positiva de la",", es fa una nova edició de la Zombie Walk, una caminada de zombis pels carrers de la ciutat. Si hi voleu anar i teniu ganes de maquillar-vos a casa, us donem uns quants trucs. Ha visitat el plató de l'Infok Ricardo Ramos, un maquillador. L'imitador i humorista"
"el 7-1, ha vingut la lògica relaxació i això ho ha aprofitat el Ripoll per aconseguir dos gols, deixant el 7-3 final que maquillava una mica el resultat. Amb aquest resultat es segueix al davant i el Ripoll, bon equip que avui s'ha vist superat, però que","dinamitzar el dia amb un taller de maquillatge en el qual s'oferia la possibilitat de que pares, mares, tiets, avis... maquillessin als respectius infants. Formulari de cerca Esteu aquí JEV commemora el Dia Internacional dels Drets Humans Dimecres,"
"pau que aquest pot ser va ser el programa més tranquil que hem tingut fins ara. Rosa és una persona tranquila, sempre va maquillada d'un somrriure especial i contagiós que li regala ... Continua llegint → El Mag Txema, un funcionari de presons que és",", l'ORTF retratava les dones com treballadores que ocupaven un lloc a l'espai públic, no només a casa. La llibertat per a maquillar-se i per a triar vestit era un reflex de la resta de llibertats. Així doncs, la cultura francesa (de tall europeu occidental"
falsa o inexacta; per manipular els desigs de les persones; per crear frustracions personals; i per falsejar o maquillar la realitat principalment. No obstant això de vegades trobem obres publicitàries que són molt boniques . Que volen,"en lloc d'una cavalcada de reis. És per això que es va decidir tornar a pintar-los, per cert ja fa molts anys que no es maquillen amb betúm de les sabates i no deixen rastre a les galtes dels petits. Per fer de rei no només compte el físic també s'ha de"
"amb l'extrema dreta, però cal tindre en compte que, fins ara, aquesta complicitat sempre s'intentava camuflar o maquillar , de manera que públicament la dreta amb façana democràtica no s'exposara a l'escarni que presumiblement aquesta","empolvoren el nas no són sinó unes bagasses , i sempre m'ha tocat mesurar-ne molt bé el punt perquè no notara que m'havia maquillat ; però, amb el pas i el pes dels anyspareix que la persona a tot s'acostuma, ha deixat de fer-me'n cap comentari: ni per"
"al partit massa tard. De fet, els tarragonins guanyaven al minut 33 per un clar 0 a 5. Aldrich, Serra i Mateos van poder maquillar el resultat. Tampoc no va tenir problemes el Liceo per imposar-se a la pista d'un Blanes. Els de Ramon Benito van repetir","un blogaire que tot just enceta la seva experiència a les Amèriques. En el tercer, una dona de no menys de seixanta anys, maquillada com per actuar a un Music-Hall i amb un abric de visó de quatre dits de gruix, em va fer explicar totes les funcionalitats"
"empresaris del sector del cava consultats no tenen dubtes que la bona marxa de vendes de Jaume Serra a preu molt barat ha maquillat els resultats globals de vendes del cava durant el 2009, que han caigut un 3,7%. També causa inquietud en el sector les",amb les disfresses que ells mateixos han confeccionat per l'ocasió en les últimes setmanes. I sobretot també ben maquillats . Aquest és el cas dels alumnes de l'escola del Petit Estel que s'han pogut veure aquest matí en la rua que han fet pels
"opció independentista extra-parlamentària. D'aquesta manera, els mesos més difícils i perillosos d'ERC quedaran maquillats per la possibilitat de tocar campanes i anar a la processó. És a dir, de mantenir un govern amb l'unionisme més pur i fer","li pregunten ""Et mataran de nou avui?"" El nostre protagonista entra en un teatre. Ramiro inicia la seva transformació maquillant-se amb una foto d'Allende al davant. La sala del teatre està completament deserta. Ramiro-Allende, recrea amb un monòleg"
perden per aquest partit a Alberto i Valderas per sanció i a Cebri per lesió. Els visitants intentaran guanyar per maquillar la temporada irregular que han realitzat. L ́Europa després d ́encadenar 1 punt dels últims 12 disputats intentarà fer,"de l'entorn. Per tant, encara que de manera intrínseca el maquillatge no impedeixi respirar a la pell, el cutis maquillat acaba ""brut"" al final del dia. Llavors, és imprescindible desmaquillar-se a la nit amb un producte adequat. Et"
"tortures i que no demanen compensació economica ni res.... Lamentablement, el govern no ha après res més que no sigui maquillar aquests greus fets i amenaçar de denunciar a Amnistia Internacional, en comptes de netejar el seu pati. La politica del","té el seu propi folklore, la seva música i els seus vestits de gala, en especial els vestits de les dones, que a més a més es maquillen la cara i es posen alquena a les mans i als peus. Una altra mena de festa són els mussems , que es celebren en torn a la tomba d'"
"l'equip local va tenir que jugar-ne 8 amb inferioritat numèrica, el que va provocar que l'equip local aconseguira maquillar el marcador amb el resultat final de 19 a 17. A la fi, la recompensa dels dos punts que es queden a casa i la sensació d'haver",": Es pot fer un a un o en grup. Cada alumne està assegut a una cadira. Als nois els hi diem que s'han d'afeitar i a les noies maquillar-se . Han de ser molt ... Continua llegint → Mitjans audiovisuals Espai d'Arts de Roca Umbert ""Retalls"" dimecres, 29 de maig"
"aconseguit el seu segon gol, mitjançant un llançament de penal córner i, en l'últim minut del partit, Koke Rodríguez ha maquillat el resultat. Un cop aconseguida la victòria, només quedava esperar les notícies que arribaven des del Pla del Bon Aire.","claror del nou dia després de tota quanta cosota i d'aquell son tan profund que us vencé. I es féu de dia ja, i Susanna sense maquillar i més atractiva encara. Les frases de Salter i la concisió, paraules justes i sense turbulències. L'estil ho és gairebé"
"de casa a Europa, van encaixar tres gols en els primers minuts que els va ser impossible remuntar. El gol de Borja només va maquillar el resultat. El secretari tècnic Manel Domènech reconeix que ""hem de fer alguna cosa per canviar aquesta dinàmica que","dia m'ho dic a mi mateixa quan em llevo i em miro al mirall, però quan veig de bon matí la cara que faig, mig adormida i sense maquillar , els ànims em cauen als peus. llegir més Quan no coneixes gaire algú no saps fins a quin grau de confiança hi pots tenir."
", el gol de Buba –que també va fer un doblet- ja va deixar el partit sentenciat, tot i que Jose Flores va acabar maquillant el resultat. El Llagostera B segueix doncs, en places de descens i haurà de reaccionar en un 2014 que començarà,","de llavis, colorets... i sempre amb el consell expert d'una Consultora de Bellesa. En aquest taller t'ensenyaran a maquillar-te , mentre ens ho passem d'allò més bé. Després anirem a sopar a Moncho's per acabar de celebrar bé la Nit de Nadal ben guapes"
"i teleològic -Espanya ja existia a la Preshistòria-, margina descaradament realitats socials com el moviment obrer i maquilla la dictadura franquista. No és un programa d'història, sinó un exercici perillós de retorn al passat més ranci. En","de maquillatge en la pel·lícula lacrimal està relacionada amb pitjor visió. Vuit de cada deu entrevistades es maquillen els ulls més de tres vegades per setmana, i moltes d'elles manifesten dificultats en la visió que millora amb el"
"video reclama a la classe política que s'acabi d'una vegada per totes amb les mentides, aflori la veritat i es deixin de maquillar les xifres: Victoria Grant, una canadenca de 12 anys, explica com funciona el sistema bancari al seu país natal, un",", hipersensibilitat... que les fa més vulnerables a aquests problemes. Totes les dones analitzades que s'havien maquillat al voltant dels ulls presentaven restes de maquillatge en la pel·lícula lacrimal. La presència de maquillatge en la"
"forces minuts el resultat, però finalment el Júnior va fer dos gols més, deixant un 5 a 0 clar al marcador, que només va ser maquillat per un gol de bandera den Jordi Massenello, amb un xut en paràbola des de la frontal que va entrar arran de pal després de",de vida independent i usuari del Servei ... Necessiteu idees per fer-vos una disfressa per al Carnaval? No sabeu com maquillar-vos per semblar Frankenstein o un lleó ferotge? O tal vegada ho voleu saber tot sobre la tradició del Carnestoltes? Si us
"horroritzat . Un món que els estats totalitaris del segle XX van convertir en realitat palpable i que, convenientment maquillat pel marquèting, deu ser encara el nostre."" - 3. Introducció: ""Kafka: voluntat d'escriure"", pàgina 19 ""Per a Kafka la",", les presses ens obliguen a ""anar per feina"". Dediquem uns minuts a la higiene personal, ens arreglem els cabells i ens maquillem de pressa per sortir ràpidament al carrer a enfrontar-nos a la jornada laboral. Per norma general, és durant el cap de"
Fa unes setmanes destacava en un article que torna la pitjor herència dels anys trenta. I és que una extrema dreta maquillada de populisme torna a galopar amb força per la vella Europa si és que en algun moment ho havia deixat de fer. Viktor Orban a,"passejades i excursions, fer la vora a uns pantalons, fer encàrrecs, ajudar en mudances, elaboració de pastissos, maquillar per una festa, ensenyar manualitats, rentar o planxar roba, consells per viatjar, etc. Els serveis per intercanviar"
"fundador i fins ara candidat, Jean-Marie Le Pen, ha cedit el ceptre a la seva filla, Marine Le Pen. Aquesta va començar a maquillar la cara del partit, molt dura i aspre, suavitzant les formes del discurs però no el fons. I fins ara aquest incipient","solució de tots els problemes però ajuden a passar millor els mals tràngols. Tanmateix una persona senzilla, vestida i maquillada de manera sofisticada, pot semblar una altra persona. El curs permet no només conèixer com aplicar Scratch i Arduino."
". Articles | Xifres i trampes Xavier Roig, en un article publicat al diari Avui es fa ressò de la darrera estratègia per maquillar la xifra del creixement econòmic real de Catalunya . La UE publica anualment les rendes per càpita de totes les regions","on l'equip de Xaropclown al complet regalàvem gossos, flors i altres objectes impossibles amb globus de colors i també maquillàvem les cares dels petits i grans que es varen atrevir a posar-se a les nostres mans! Volem donar les gràcies a les persones"
"les discriminacions, i un llarg etcètera al qual ja estem acostumats. Mentrestant CCOO, UGT i la CGT, intenten maquillar la postura contraria al traspàs, demandant un procés de negociació per poder diluir el traspàs al màxim. Un bungalow,","als rics. Intenta enfilar l'agulla amb un raig de sol de la matinada en lloc de fer-ho amb el fil d'un propòsit que no dic. Maquilla la pal·lidesa de color blanc. I així, al final del camí, troba la mitja llimona, o mitja ceba, o mitja vida. dilluns, 7"
"una bola perduda de Teixidó dins l'àrea per establir així el definitiu 2-5. El Noia, a pocs segons del final ha pogut maquillar una mica el resultat amb una falta directa, però Grau ha impedit que Teixidó marqués. El CE Noia s'ha d'enfrontar aquest","he escoltat les altres cançons, i ara està sonant Love is a losing game . Coberta de tatuatges, punxada pels pírcings, maquillada com mai no em maquillaré, la meva ànima bessona, ara ja per sempre desconeguda, canta els jocs d'atzar, d'alcohol, de"
"Sílvia Ferrer i Judith Milla , serviria perquè aquesta última marquès el 5 a 1 a plaer. Daniela Guerro va tenir l'opció de maquillar el resultat, a falta de 20 segons, de llançament de penal, que l'àrbitre va fer repetir. Però no va poder fer el segon","cançons, i ara està sonant Love is a losing game . Coberta de tatuatges, punxada pels pírcings, maquillada com mai no em maquillaré , la meva ànima bessona, ara ja per sempre desconeguda, canta els jocs d'atzar, d'alcohol, de llàgrimes seques i amors"
