"resultat de 14 a 2. Però la segona meitat va ser un altre cantar, les jugadores olivenses van eixir disposades a maquillar el resultat i donar tot el que tenien dins...i així va ser, amb un poc més d'agressivitat defensiva es va aconseguir",": ""Diuen que és fastigós jugar amb mi al Trivial"" Es fa estrany veure Jordi Hurtado (Sant Feliu de Llobregat, 1957) sense maquillar i sense un faristol al davant. L'home-concurs d'Espanya ens ha citat al bar El Foment de Molins de Rei, on després sabrem"
"un possible empat. Caterina Ortega va realitzar bones actuacions. Seria a 38 segons pel final que Adriana Gutiérrez maquillaria el resultat amb el 3 a 5 final. Amb una defensa molt vulnerable, el Cerdanyola CH Femení es deixava perdre un partit per","coses i tenir-les en ment. I els dies de gravació és una altra dinàmica. Cap a dos quarts de nou estic a Sant Cugat, em maquillen , vaig cap al plató i apa, a enregistrar programes. Coneixes els concursants i és tota una jornada de matí i tarda parant"
"que va aprofitar l'Osasuna, almenys, per fer el gol de l'honor. Oriol Riera , que acabava d'entrar al terreny de joc, va maquillar el resultat amb una espectacular rematada des del primer pal, de taló, que va entrar per l'escaire oposat de la porteria","de purpurina, que combinada amb una pasta enganxosa del raïm morat i madur, serveix perfectament per estampar la roba i maquillar mans, braços, cames i cares. Dinem a l'àrea de lleure de l'ermita de Sant Gregori a Falset, alguns amb estovalles, amb"
"estan finançades per préstecs. Aquest fet provoca una distorsió evident en el compte d'explotació del 2010 que maquilla el resultat, doncs incrementa la despesa pel valor d'aquestes operacions mentre que els ingressos no varien al ser","de l'hospital Dr. Josep Trueta. La dinàmica de les intervencions > L'equip de pallassos, prèviament vestits i maquillats , i abans de l'inici de les actuacions, recullen la informació necessària de l'estat dels nens hospitalitzats amb la"
"pesat del nacionalisme"", i va recomanar que si es recorre al TC després es compleixin les sentències. El PP va maquillar els arguments darrere la crisi i l'atur juvenil per beneir la llei Wert. Juan Milián va apel·lar ""al dret","per trobar bé les coses i veure perfectament el que fas. A més, també facilita la neteja. I el millor per pentinar-te i maquillar-te és col·locar un bon llum de paret a cada costat del mirall. D'aquesta manera, evites les ombres i t'assegures de tenir"
"amb el control del casino amb un soci estranger ho tindrien francament fàcil per declarar nòmines estratosfèriques i maquillar els beneficis de l'empresa, com ho poden fer actualment directius d'entitats financeres i un llarg etc. En quant a la","costat del mirall. D'aquesta manera, evites les ombres i t'assegures de tenir les pestanyes i els llavis perfectament maquillats . Escullis la il·luminació de bany que escullis, no oblidis comprovar si necessites bombetes. Recorda que nosaltres"
l'Estatut ja no són importants. ERC es llença desesperadament a assaborir la mel del control de les institucions per maquillar la crua realitat que ha perdut el 24% del seu electorat mentre ICV se n'adona que per no fer ben bé res no li calien els,"és difícil trobar un grup que s'adapti a tu, si el trobes pots estar feliç i sinó fer això que he dit i transformar-te, maquillar-te i continuar sent un pallasso i no el director d'aquest circ que és la teva vida. Cada dia us estimo més i us odio més, us"
"Carta por la Ciencia, explica en un article a El País com el govern espanyol no només redueix, sinó que també maquilla les xifres dels pressupostos de R+D. El nostre company Manel Esteller ha publicat un article a El Periódico on descriu","per tirar-ho tot endavant, perquè en un grup de teatre amateur tu ho fas tot, des de netejar la sala fins a cosir la robeta, maquillar-te ... Tot, tot, tot! Hi ha un altre problema: abans hi havia una miqueta més de suport econòmic, però la crisi ens afecta a"
"a convertir-se en un monòleg visitant. Els darrers 10 minuts van suposar un tràmit en el que ni tan sols la Penya va poder maquillar el marcador, al contrari. Exhibició de Xavi Rabaseda que va oferir espectacle en el seu personal 100% en tirs i 16 de","el action man amb braços extraibles al joc raro educatiu per nen de tres dies, fins a la nina ultra-fashion que la pots maquillar i comprar-li un munt d'accessoris. Amb lo bé que m'ho passava jo jugant amb el lego. Nota de premsa de la confederació"
"de la seva tauleta a 140 dòlars (109 euros) La tauleta d'HP no pot passar desapercebuda, la HP Slate de set polzades ha maquillat el seu preu encara més, s'ha rebaixat 30 dòlars més i el seu preu ara és més que assequible i una autèntica ganga si no tens","esponges o raspalls, perquè et poden irritar la pell i empitjorar l'acne. • Si utilitzes esponges o mocadors suaus per maquillar-te , manten-los nets. Què és l'acne juvenil? L'acne és una afecció de la pell que causa la formació d'impureses o grans a la"
els 20 punts d'avantatge abans dels 10 darrers minuts. Només Oliver des de l'exterior i Nacho Llovet a dins han intentat maquillar un resultat que ja era massa complicat de capgirar. Ara a més s'afegeix un nou equip a la possible lluita per la vuitena,", preciosa. Una dona – per al conscient, subconscient i jo diria que fins i tot l'inconscient d'una dona russa – va maquillada , curosament vestida, perfumada: se sent una dona perquè és bonica. El fet de tenir diners, de ser intel·ligent, de"
"d'aquest perfil. La nova direcció, molt més propera i supeditada als mandats del PSOE, ha anat diluint el catalanisme, maquillant-lo de federalisme, és a dir, de cafè per a tots i perdent identitat enfront el projecta de l'Espanya socialista de ZP. Això i",". I als carrers d'Andorra, cada cop que miro les meves compatriotes, em sento orgullosa d'aquelles dones elegants, maquillades i precioses. Les miro, i somric pensant que ho fan molt bé. Si les coneixes més de prop, naturalment poden resultar tan"
"encara no s'ha complert. Un somni d'Alanis, l'escriptor. Els dies d'estiu a Cartago anaven vestits de blanc lluminós, maquillats de blau mediterrani i perfumats de gessamí. Ciutat presumida, quan queia la tarda canviava el vestit resplendent per","un cobriment de cor. No ho confonguem amb el glam , amb els excessos de Bowie , amb en Peter Gabriel vestit amb malles i maquillat de senyora. Allò tenia un sentit. Era part de l'espectacle. Era una estètica treballada que obeïa a uns cànons i a una"
"13 diputats al Parlament el 2003, els esta passant factura. Així doncs, no és massa difícil veure com la necessitat de "" maquillar "" el més que probable mal resultat a les europees és prioritari. L'excusa ""aglutinar les forces catalanistes"" en un",", però sempre molt pendents de les notícies d'última hora. Nosaltres, els presentadors, a més de dedicar un temps a maquillar-nos i pentinar-nos, també escrivim la portada del telenotícies, revisem les entradetes i... cap al directe! Quin creus"
"tothom coneix i comparteix als bars i en converses informals –però que quan hi ha una càmera de televisió semblen voler maquillar i descriure d'una manera més ""democràtica""–, la qüestió sempre acaba sent la mateixa: davant d'això, què fem? La","hauria de defensar Catalunya enfront del PSOE i que no ho esta fent, com en Corbacho, que es un home i no sé si vesteix bé, es maquilla o es fa un recollit en forma de monyo. No só tampoc un fan de la ""carma"" ans el contrari, però trobo patètic, que una dona"
de l'equip cinctorrà sobre el de Tírig ha estat més evident. El resultat de 6-0 és una prova clara. El Tírig ha intentat maquillar al final el resultat amb un gol de l'honor però els seus davanters no han estat avui encertats. La 6a tinenta d'alcalde,popular i un taller de malabars en el marc de la Festa Major i en el marc de la setmana jove un taller per aprendre a maquillar-se que es durà a terme a les 18.00h al Local Social. A la nit hi haurà Festa Jove amb Hotel Cochambre i Discoteca mòbil. Per
"Estic d'acord. Les coses s'han de dir pel seu nom i amb claredat i sinceritat sempre. No maquillar , no ocultar, no enganyar. I com a voluntaria... sento que formo part del grup en el que lliurement em presto Les",". Les professores de l'Escola Montserrat Fajardo havien decorat les instal•lacions amb aquesta motiu i elles anaven maquillades amb caracteritzacions relacionades a la festa. Amb aquest entorn terrorífic, però amb caire familiar, vam poder"
"per endavant i sentenciés el partit. Tot i la pressió immediata i el treball dels locals, tan sols van ser capaços de maquillar el marcador fins arribar al 6-9 final. Amb aquesta victòria, el filial de l'Olímpic Argentona fa un pas endavant a la","quan Manuel Fraga Iribarne era ministre d'Informació i Turisme, en uns moments en què la dictadura mirava de maquillar-se amb més o menys voluntat. La concepció de Gorg defugia, des del principi, la temptació del localisme. Així calgué"
"fonts , no només no ha augmentat, sinó que ha disminuït. Pel que dóna el mateix el que ens diguin, que sempre sabran com maquillar la realitat , tant els uns com els altres. Ara, la qual cosa tampoc vaig a empassar-me són les causes a les quals atribueix","d'estratègia, com en espionatge per a observar sense ser observat (el periscopi), per a enlluernar, avisar, assajar i maquillar-se . Els miralls són a dins de les cases, en la vida quotidiana, i n'hi ha de totes mides, des del de Viganella fins al"
". És una reconstrucció personal en el que és formal, molt divulgativa i amb aportacions suggestives. La narració maquilla el contingut - que parteix d'allò conegut - convertint el llibre en un bon complement a la resta de bibliografia,","per a les nostres aventures... Trobo que xerren massa, potser no calia que publiquessin una foto on surto jo sense maquillar , però segur que ho han fet amb bona intenció, que el Jorge i la Mariale són gent de bona pasta. El clínic de dia 21 d'abril ha"
"del costat matalasser. Dues marques ràpides en tan sols dos minuts han situat un 22 a 9 inabastable, que només han pogut maquillar els visitants amb una marca amb el temps complert, mentre els locals començaven a festejar la victòria i la","l'hora d'entrar a plató, allí ens van col·locar a les grades i vam retrobar als nostres companys concursants, vestit i maquillats per a l'ocasió. Un regidor molt simpàtic ens va donar les darreres indicacions per tal d'animar als concursants, vam"
"un bon partit, han estat incapaços d'anotar cap marca fins que el temps ja estava complert –només ha servit per maquillar el resultat– i han acabat caient als últims minuts contra un equip més sòlid en defensa i ràpid en atac. De bon principi s'","de la roba dels domadors. Simpatitzava amb els pobres animals ballarins imaginaris, i amb els pallassos de cara maquillada i ulls desamparats. Em sentia a la porta d'un espectacle que canviava la vida: no pas la vida quotidiana, sinó l'"
"fetes a partir d'una bona foto i aquesta em va captivar. Una altre exemple de que si la matèria prima és bona, no fa falta maquillar la portada amb elements de més. Tot i arriscar-se amb una foto de grup a la portada (cosa que, per altra banda, sempre","i forestals. Aquesta sessió fotogràfica està pensada per a les mares que cada dia van a mil per hora, que molts cops es maquillen per inèrcia i no per desig, que no tenen temps per recordar o valorar la pròpia bellesa... Perquè et prenguis un moment"
", però, demà aquesta classe dominant, si a darrera hora el populatxo no se li esvera, haurà aconseguit el seu propòsit de maquillar la protesta i despistar el personal. Davant d'això, teníem dues alternatives: abominar d'aquest espectacle o bé","eina per a relacionar-se amb l'entorn social i afectiu alhora que gaudeixin de l'experiència de pujar a un escenari, maquillar-se , trobar un personatge, imaginar.... i crear! El teatre permet treballar multitud d' aspectes curriculars : llengua"
"funcionaments dels hospitals que regeixen, ja se'n carregen els gerents de presentar els comptes sense el detall i maquillant el que els interessa. Això sí, a l'hora de retallar...lo més fàcil, acomiadar professionals, tancar quiròfans i","han anat per les illes buscant la resposta als enigmes ""on està el rei?"" En una sala ambientada, i tots ven disfressats i maquillats per l'ocasió, vem dur a terme el ritual final de l'aventura; els aventurers i les delegades de les illes van anar posant"
"aquesta dinàmica, ans al contrari: simplement desvien les mirades cap a les polítiques neoliberals que intenten maquillar la realitat i els permet, per la via de la poltrona, mantenir el seu propi estatus. Davant d'aquesta situació, cal que","setmana aproximadament a caure. Les de les mans i escot uns vint dies. Quan serà possible fer servir maquillatge? Podrà maquillar-se per dissimular les crostes. Quan caiguin, haurà de fer servir protecció solar. ESPLAC A LA XARXA Arxius per dia:"
"no es pensi que quedaré indiferent. No s'assegura el benestar ni la convivència tombant lleis, corrent aventures ni maquillant la gravetat de les conseqüències'. Per més que ha dit que el referèndum no es pot fer, Rajoy ha fet campanya pel no; no","puntejat, que s'utilitza quan només es vol aconseguir un efecte òptic de farciment de pestanyes sense que sembli que va maquillat , es pot fer tant a homes com dones, i el delineat, que la línia es fa més gruixuda, allargant del final i corregint"
"la situació actual, ja que simplement consisteixen en rebaixar els nivells d'exigència per promocionar , per tal de maquillar així el fracàs escolar. A continuació es comenten aquests canvis i els seus defectes: 1.) Certificat de competències","els protagonistes que fan l'obra en català, ens ensenya com és l'escenari pel darrere i com els actors es vesteixen i maquillen . En el món natal del nen robot Poko el malèfic androide Dester vol aconseguir el poder total. Dester controla els"
el segon semblava que havien descentrat l'equip lila que va anar 15 per sota (16-31). Només una petita reacció final va maquillar el resultat i va donar aspiracions de triomf a les locals ( 22-31). La segona meitat va ser molt diferent. El Nemser va,"; 19:38 Roser - 10 anys - Cardedeu Jo he tingut sort perquè el meu cos no em desagrada, però em fa força ràbia la gent que es maquilla o es fa coses al cos i després et ve i et diu que si fas això o allò quedaràs millor... i li dius que si vaig o em poso d'aquesta"
"el control sobre el cos de les dones pel que fa als drets sexuals i reproductius. Amb l'excusa de defensar la vida, es maquilla la veritable intenció, que no és altra que la submissió de les dones i la garantia de la perpetuació de la mà d'obra barata","; i això no és gaire bo. Llavors com que són famosos donen exemple als altres. Fins i tot hi ha gent de la meva edat que es maquilla i es posa cremes per la pell! Això ja és massa! 10 octubre, 2013; 19:38 Roser - 10 anys - Cardedeu Jo he tingut sort perquè el"
"de plantar cara a la construcció d'aquest model d'Espai Europeu d'Educació Superior (EEES) i, més aviat, intenta maquillar-ne certs aspectes; i per un altre existeix una debilitat organitzativa i de coordinació del sector estudiantil","cal estar prim ni gros ni ser guapo ni lleig, sinó natural, sense tenyits artificials (tret que es faci un personatge) ni maquillats , ni joies ni res que 'despisti' de l' interès essencial que és l'actor o el model o l'artista o la persona (que això també"
"Of i altres rareses de final d'any jo també havia de posar el meu granet de sorra i felicitar-vos un nou 2009 intentant maquillar el desastre general que ens deixa un 2008 en crisi, i no només en sentit econòmic, amb el que a molts ens farà més senzill","h al Museu de la Mediterrània. L'autor ha preparat un acte-espectacle en el que hi participaran nombrosos vampirs maquillats per Kendra Irigaray, maquilladora professional que ha treballat amb molts famosos. La sessió de maquillatge es farà a"
"menys en l'autonòmic ni en els ajuntaments ""perquè tots estan implicats i la reforma que ara pretenen aprovar només maquillarà la llei"". La seua visió està orientada a Europa i el seu govern ""i creiem que ara és el moment just d'implicar-nos perquè","sembla talment un cap d'Ife: com m'agradaria acariciar-lo per saber si és real o una escultura. La senyora del costat es maquilla , presumida, i es mira en un mirall que diu: ""j'adore le printemps""...I le printemps és pura ficció. Tot aquí és"
", és estrany que l'homenet que comanda la Conselleria d'Educació no haja pensat encara en aquesta possibilitat de maquillar els nefastos resultats de la seua gestió. D'altra banda, si ens creiem les seues mentides, i sobretot si –com cal","ferides, cicatrius i bigotis, barbes com a postisseria. Alhora que els maquillaven també els ensenyaven a maquillar-se . Per altra banda, les alumnes de primer i segon d' Estètica PD van maquillar els petits de P3,P4 i P5 com als"
"persones aturades per fer front a la campanya estiuenca, encara que només fos de caràcter temporal, però que servia per maquillar les dades anuals. També considerem que sha de tenir una especial atenció amb els més de 70.500 menors de 25 anys que shan","gènere cinematogràfic amb unes magnífiques ferides, cicatrius i bigotis, barbes com a postisseria. Alhora que els maquillaven també els ensenyaven a maquillar-se. Per altra banda, les alumnes de primer i segon d' Estètica PD van maquillar els"
"i dels quals la protagonista ha sortit sempre victoriosa. Aquest procés, però, no està idealitzat, perquè l'òpera no maquilla el que d'aquests dos personatges diu la història: que Neró va ser un dèspota colèric i que Poppea era una cortesana","Personal i Decorativa per a caracteritzar els petits actors d'aquesta escola. Les alumnes de perruqueria van maquillar al pur estil d'efectes especials de Walking Dead, Zombie Attack...i pel·lícules d'aquest gènere cinematogràfic amb"
"les alers locals. La diferència va ser per moments de 20 punts en el marcador. A l'últim quart l'equip visitant va poder maquillar el resultat, fruit de la relaxació de l'equip local amb la tranquil·litat que el partit estava sentenciat. Sembla ser","En la majoria de casos fer l'Estel és una tradició que es passa de generació en generació. ""La meva mare sempre havia maquillat l'Estel, el meu pare havia fet de dimoni i de mossèn i també ballava a l'Esbart"" explica la Míriam, que fa 20 anys que fa la"
"la solució. Així, tots dos partits han perdut més de 3_milions de vots, pèrdua que en el cas de Nova Democràcia ha quedat maquillada per la llei electoral grega, que atorga al partit amb més vots 50 electes més. Si no existís aquesta norma, en tindria 33","ho faci en breu. Aquesta és una activitat per viure en família. Amb ajuda d'un professional els pares i mares aprendran a maquillar per Carnestoltes als seus petits . I per als més atrevits, també podran deixar-se pintar per aquests! Participa a l'"
"del Mataró , que estava gairebé fora del matx: 38-55. L'equip va buscar la remuntada en el darrer quart, però només es va maquillar el resultat amb el 61-72 final. Jordi Ventura , fluixet com a jugador , nefast com a entrenador. Per cert quants minuts va","el major espectacle del món... FRONTAL: Apareixerà un mestre de circ, amb un pur en la boca, abillat amb casaca roja i maquillat de blanc invitant a entrar al major espectacle del món. PISTA 1 – l'ELEFANT DESAFIANT: Un elefant amb un otòfon de sord i"
"rabia contenida, la noche y el vicio. Orgullosos de su música y de sus origenes, siemps se han expresado a las claras, sin maquillar su lenguaje ni su inconformismo..."" N'crisi Ska Divendres 15 de juliol N'crisi neix el gener de l'any 2008 al Vendrell (","cabell marronós , vistos i molt alegre que sortia acompanyat a les cercaviles de la seva parella la Filomena una dona ven maquillada i maca que portava al cap un mini barret vistos i alegre. Aquets nans foren construïts per en Francesc Cisa. Foren"
"d'alguns centres per part dels respectius ajuntaments? Per què s'ha venut l'exposició com a un aparador que maquilla l'esmentada situació de precarietat, només superada per la bona pràctica dels professionals independents de la","podríem dir que el concert de Manson va ser complert i justet. Complert per que vam veure al reverend en acció, a gent maquillada , a gent encara més maquillada, a gent repartint mastegots, a gent rebent mastegots ... Vam escoltar balades, cançons"
"reduït públic imparable, contagiat d'agitació, com el que assistí la setmana passada al Luz de Gas. Elegància i classe maquillaven al sempre superlatiu sextet The Expressions, principal sentinella de la flama que crema a la discogràfica de Brooklyn","princeses dels contes de fades . Són unes nines primes, camallargues, pàl·lides, malaltisses,que van extremadament maquillades i porten talons altíssims. Entre elles hi podem trobar nines amb aires de Frankenstein, vampires vegetarianes, dones"
: és injust. Si t'equivoques en un càlcul no és culpa meva. Però és que a més era un error voluntari. Ah si? Totalment. Per maquillar el dèficit i esquivar alts tipus d'interès. Bon viatge a la Pl. St. Jaume ESTRÀBIC JO? Preguntat al final de l',". En refereixo naturalment al funest Boadella que cada cop es troba mes còmode entre la dreta més rància de Madrid i la més maquillada de Barcelona, encara que en el seu cas, durant el pas per Els Joglars si més no, ja se li veia el morro al llop. Gràcies a tots"
"de GESOP per a El Periódico - . Sigui com sigui, la convivència amb la líder del PPC haurà de ser forçosa, ara que s'ha maquillat de catalanista –amén de ser una de les ninetes dels ulls de Rajoy-. L'estabilitat catalana passarà, com ara i sempre,",", empreses que es lucren a base de fer sentir a les nenes éssers de color rosa on la seua màxima aspiració és aprendre a maquillar-se i a posar com a models essent subjectes presos a estúpids i agressius rols de gènere, missatges sexistes des dels mass"
"l'entrada el 10 de gener perquè la visita, asseguren, no estava ""preparada"". ""Ha sigut una visita organitzada, volent maquillar o endolcir una realitat obscena des del punt de vista dels drets humans"", va afegir Laia Ortiz, diputada d'ICV-EUiA al","sentit homenatge. dimecres, 17 març de 2010 Per parlar amb meva connexió canillenca m'he posat un vestit formal i m'he maquillat el mínim. Porto talons i cabells recollits; per saludar-nos ens hem donat la mà. Encara no ens coneixem, i veig que la"
"Municipal Socialista, Raquel Sánchez ""una retallada del sistema democràtic i la participació ciutadana que es vol maquillar amb els adjectius de sostenibilitat i racionalització de la despesa"". Per a Sánchez amb aquesta reforma pretén ""","en policia científica de la Regió Policial Metropolitana Sud i dels serveis centrals. El ""mort"" serà un figurant maquillat per l'ocasió. Simularà ser un advocat al qual han tallat el coll en el seu despatx. L'activitat comptarà amb mossos"
"Gil han tancat el definitiu 12 a 0. A les acaballes de la segona part l'Uri ha disposat d'algunes ocasions per tal de maquillar el marcador, però el travesser i Àlex Aguilar han impedit que els visitants retallessin distàncies. El Vilanova, avui",", li fem aquest favor. A ell, i a tot el món sencer. La cosa millora. La bruixa segueix semblant allò que és, però una bruixa maquillada té personalitat, té... bé, caràcter. No és cap bruixa avorrida. És tot un ésser màgic amb poders de convicció. Per això"
"el divendres"". 4. De les candidates, determinem el grau en que compleixen els objectius . Schwartz veu com la majoria maquillem els resultats segons el nostre equilibri psicològic. 5. Decidim quina és la opció escollida. Schwartz es queixa que",", o vestits jaquetes i sabates amb talonets, i arrecades cursis o ulleres de sol fascion (nosé com s'escriu), m'haig de maquillar cada dia, i anar al gimnàs i nosé quines històries més...és a dir sé de que estàs parlant... No defalleixis els escarbats"