"la nit. Un grup d'entre dos i tres individus va atracar el complex BonÀrea, es van endur 40.000 euros de la recaptació i va agredir el vigilant després d'amenaçar-lo amb una arma de foc. És l'últim capítol d'una sèrie d'assalts que s'han produït les",considera que ha quedat provat que Mehdi Touil i Aalae Eddine Toulali van entrar a robar al bar el 22 de maig del 2012 i van agredir brutalment a cops d'ampolla l'encarregat d'obrir l'establiment als matins. La víctima va quedar molt malferida i va
ja fa un temps que la prohibició de plegar cargols està implantada. Tarragona (ACN).- Els tres acusats de segrestar i agredir sexualment una dona a Salou el març del 2012 han negat els fets aquest dimarts en el judici que se celebra a l'Audiència de,"persones va destrossar el material que hi havia a la parada, enduent-se la bandera espanyola que hi onejava, a més d' agredir les persones que s'hi trobaven en aquells moments. Hores més tard, la policia va deixar Hásel en llibertat a l'espera de"
un menjador social per agredir-ne un altre REDACCIÓ | MANRESA Un veí de Manresa de 43 anys va ser detingut ahir després d' agredir un home a cops de puny i perseguir-lo amb un ganivet pel menjador social del Centre Cívic Selves i Carner de Manresa.,". Polònia: Polònia - 15/05/2014 En aquesta edició, Pere Navarro (David Olivares) intenta identificar la dona que el va agredir . El líder del PSC es troba cara a cara amb Manel Prat (Ivan Labanda) per donar-li tots els detalls sobre aquell fet. A més,"
"fets van tenir lloc aquest dijous al menjador social Selves i Carner, quan la policia va rebre l'avís que un usuari volia agredir un altre amb un ganivet. En arribar al lloc dels fets, els agents van trobar el presumpte agressor i la víctima, que es","d'Espanya que en la pròpia Comunitat Valenciana"". Detingut a l'Olleria (València) un fugitiu britànic acusat d' agredir sexualment els seus dos fillastres de 8 i 11 anys Agents de la Policia Nacional han detingut a la localitat valenciana de"
"el va poder enxampar en plena feina. Quan els agents van entrar al local, el noi va sortir d'entre la foscor i els va agredir . El lladre duia les mans ensangonades perquè s'havia tallat quan va trencar el vidre. Tot i que va intentar fugir, les","11 anys Agents de la Policia Nacional han detingut a la localitat valenciana de l'Olleria un fugitiu britànic acusat d' agredir sexualment els seus dos fillastres de 8 i 11 anys, els quals a més copejava i els amenaçava amb lliurar-los als servicis"
"discapacitat va ser la principal víctima de l'actitud violenta d'un jove, jutjat ahir pel Tribunal de Corts, que el va agredir durant la festa major de Sant Julià. Després, en ser detingut, va insultar i amenaçar els agents de policia. Els motius","va contraure matrimoni amb una dona, mare de dos menors d'edat. A partir d'este moment, l'arrestat va començar a agredir sexualment la xiqueta quan tenia 11 anys, aprofitant que la seua mare treballava en torn de nit. Si en alguna ocasió la"
"per danys i desordres públics. Algunes fonts indiquen que la detenció fou indiscriminada i que la policia va agredir els detinguts. Podeu resseguir els esdeveniments amb l'etiqueta #juntessensepor. La marxa, convocada per la",". Els fets van passar cap a les 21.22 hores de dissabte quan la jove estava seguda en un parc i les dues agressores la van agredir , causant-li tres ferides d'arma blanca, i es van emportar el seu mòbil. La víctima va ser trasllada a un centre"
"del grup de delinqüència urbana de la comissaria de l'Eixample van localitzar l'arma amb la qual suposadament va agredir la seva exparella. El detingut passarà a disposició judicial durant els pròxims dies. El Govern de la Generalitat, a","força disgustat amb l'incident i ha anunciat que denunciarà els fets perquè, segons ha dit, també s'ha intentat agredir a militants quan sortien de l'acte. A més, els populars presentaran una queixa formal al departament d'Interior pel"
"autor de l'agressió. Posteriorment, els agents van trobar en una claveguera l'arma amb la qual el hauria utilitzat per agredir la dona. El detingut passarà a disposició judicial durant els propers dies. La filla de Punset, número tres de C's a les","agents del dispositiu. La investigació continua oberta i no es descarten més detencions. Detenen un veí de Manresa per agredir una dona al carrer i sostreure-li la bossa de mà (ACN).- Els Mossos han detingut un veí de Manresa, de 29 anys, com a"
"d'època medieval a Besalú, Sicília i Montpeller Llança una ampolla de vidre als Mossos d'Esquadra quan el detenen per agredir un jove a Salt Girona (ACN).- Els Mossos d'Esquadra han detingut al jove que va agredir un noi amb una barra de ferro al cap","britànica està investigant David Moyes. Hi ha indicis que apunten que l'exentrenador del Manchester United va agredir un jove de 23 anys en un bar de Lancashire, al nord d'Anglaterra. Els veïns de la zona van trucar a les forces de seguretat"
d'Esquadra quan el detenen per agredir un jove a Salt Girona (ACN).- Els Mossos d'Esquadra han detingut al jove que va agredir un noi amb una barra de ferro al cap durant una baralla a Salt (Gironès) aquest diumenge a la tarda. El detingut és un veí de,"que és ""un orgull"" per a Catalunya tenir-hi ubicada ""una empresa capdavantera al sector"". Dos detinguts per agredir un jove en un bar i cometre un assalt violent en un locutori de Terrassa En comprovar que la recaptació de l'establiment"
internacionalització i es pot veure com el 25% dels nous contractes són internacionals. El Mosso d'Esquadra acusat d' agredir sexualment una mare a l'escola de Vilanova de Segrià diu que van ser 4 petons mutus Lleida (ACN).- El Mosso d'Esquadra i,més mal classificat en la lliga regular. Els riberencs jugaran la tornada a casa contra l'equip de Lorca. Detingut per agredir dues persones durant l'Aplec del Caragol de Lleida Lleida (ACN).- La Guàrdia Urbana de Lleida va detenir diumenge un
mutus Lleida (ACN).- El Mosso d'Esquadra i president de l'AMPA d'una escola de Vilanova de Segrià (Segrià) acusat d' agredir sexualment una mare el 9 de setembre de 2011 al centre educatiu ha reconegut que es van petonejar però assegura que va ser,"el presumpte autor de l'agressió. Altrament, la Guàrdia Urbana va detenir la matinada de dissabte un altre home per agredir un treballador d'Ilnet. Catalans, a la 17ena edició dels premis Max ""Barcelona"" és el muntatge català amb més"
"generar protestes locals i l'àrbitre va acabar expulsant Germán Mono Burgos, ajudant de Simeone, que va estar a punt d' agredir el col·legiat. Els canvis d'Ancelotti van donar més poder ofensiu al Madrid, mentre que l'Atlètic se n'anava","en una mà, on encara també hi havia el presumpte agressor. Segons la Guàrdia Urbana, el presumpte agressor també va agredir els agents que volien identificar-lo. Finalment, l'home va ser detingut com a presumpte autor d'un delicte de lesions"
"votació massiva i inequívoca sobre"" la consulta. La Policia Local de Manresa deté tres homes en una sola nit acusats d' agredir les seves parelles Manresa (ACN).- La Policia Local ha detingut tres homes, de 62, 48 i 42 anys i veïns de Manresa, com a",i equipaments esportius del municipi. Detenen un noi per fer dues estrebades de bosses de mà a Figueres i agredir una de les dones amb cops i puntades de peu Figueres (ACN).- Els Mossos d'Esquadra han detingut un jove per fer dues
"de treball social de l'Hospital. Després de simular una acalorada discussió a porta tancada, l'home de la parella va agredir i clavar un ganivet a una de les treballadores socials. Alertats pels crits que se sentien a les immediacions, el","a aquestes actituds. Talant Duixebàev podria ser sancionat durament per la Federació Internacional d'Handbol per agredir Manolo Cadenas Aquest passat diumenge s'enfrontaven, a la Superlliga polonesa d'handbol, el Kielce de Talant"
", l'alcalde, Josep Maria Vila d'Abadal, i el regidor de Cultura, Joan López. Detenen un veí de Sant Hipòlit acusat d' agredir la Policia Local a Manlleu després d'un incident de trànsit L'home, de 33 anys, també va negar-se a passar la prova d'","assegura que els preocupa que alguns individus utilitzin expressions de protesta ciutadana com a empara per agredir treballadors de mitjans i atemptin contra la llibertat professional de les persones, ""en el que creiem que és una"
"pel fugitiu en què descrivia el que anava a fer a continuació: ""disparar als nois + envestir el cotxe policial + agredir els agents "", segons fonts pròximes al cas. Els Mossos han desplegat un ampli dispositiu policial per trobar el fugitiu",la crispació. És l'estat natural que una majoria de catalans és lògic que pateixin. La qual cosa no té res a veure amb agredir a ningú. Que Navarro hagi estat colpejat no em pot limitar el meu dret a crispar-me dels nervis (és l'accepció del
"assalt va passar dijous a la nit, quan ella estava sola. Se sospita que la dona es va resistir i per això els lladres la van agredir , lligar de mans i peus i la van deixar a terra, fora de l'habitatge. No hi ha constància que els lladres robessin dins la","ara viurem un reguitzell de detencions. Ànims, que tots sabem que ets d'una eficàcia provada. Un detingut a Manresa per agredir un home al centre de la ciutat Manresa (ACN).- La Policia Local ha detingut un veí de Manresa, de 37 anys, acusat d'un"
"Instància i Instrucció número 4 d ́Igualada, el qual en va decretar la llibertat amb càrrecs. Imputats nou mossos per agredir quatre joves a Barcelona L'origen de la detenció és l'incident que van tenir amb un taxista que els va insultar perquè un",", segons la fiscalia, un grup de joves va acudir a Manresa amb passamuntanyes i amb estètica pròpia d'""skinheads"" i van agredir dos joves amb barres de ferro, punys americans i bengales. Una de les víctimes, un jove de 16 anys, va quedar en coma i va"
de que hi participessin unes 150.000 persones. La DGAIA farà un estudi psicològic i social de l'adolescent que va agredir una altra menor a Sabadell Barcelona (ACN).- La Direcció General d'Atenció a la Infància i l'Adolescència (DGAIA) de,". L'agressora de Pere Navarro va ser candidata d'Aliança Popular Montserrat Puigbó Cardellach, la dona que va agredir el primer secretari del PSC, Pere Navarro, el 27 d'abril, va formar part de la candidatura d'Aliança Popular a l'"
"i l'Adolescència (DGAIA) de la Generalitat farà un estudi psicològic i social de l'adolescent denunciada per agredir una altra menor a Sabadell, agressió que va ser gravada amb mòbil i distribuïda a través de les xarxes socials. La menor","de Manresa neguen la seva participació a la pallissa dels joves antifeixistes Barcelona (ACN).- Els 16 acusats per agredir dos joves amb barres de ferro, punys americans i bengales davant la Sala Stroika de Manresa el passat 23 de març de 2012"
"associacions. Hem de fer propostes, presentar i quan votem ho hem de fer a qui votem. Ingressa a la Model el jove que va agredir una menor equatoriana als Ferrocarrils el 2007 Sergi X.M. va entrar a un vagó de FGC una nit d'octubre del 2007 parlant","poden conrear fins que la terra depura tots els productes químics que se li han abocat"". Detenen l'agutzil de Renau per agredir l'alcaldessa després de ser acomiadat de l'Ajuntament Renau (ACN).- Els Mossos d'Esquadra han detingut a un agutzil"
". Barcelona (ACN).- L'Audiència de Barcelona ha obligat a ingressar a la presó Model el jove que l'any 2007 va agredir una menor d'edat equatoriana als Ferrocarrils de la Generalitat prop de Sant Boi de Llobregat. L'agressió, amb","la inhabilitació de l'agent durant el temps de la condemna, retreu a l'acusat la seva ""fredor d'ànim i malvolença"" a l' agredir el taxista així com l'""aleatorietat de l'atac"", cosa que per al tribunal demostra que el nivell de perillositat"
"a la classificació, Múrcia i Estudiantes. Detingut per retenir la seva parella set dies, durant els quals la va agredir sexualment i amenaçar de mort Els Mossos d'Esquadra van detenir el 28 de febrer un home de 27 anys per retenir la seva","esportius per un període de 12 mesos a cada un dels dos aficionats identificats que, abans de l'inici del partit, van agredir violentament un aficionat de l'equip visitant i li van provocar ferides de diversa consideració que van necessitar el"
"Esquadra van detenir el 28 de febrer un home de 27 anys per retenir la seva parella durant set dies, durant els quals la va agredir sexualment, la var vexar i insultar i la va amenaçar de mort amb una ""katana"", una espasa japonesa. A més, li va trencar el","proclius a la mesura. Vlad, el racista convers Quan, encara no fa un any, Vladislav T., el menor de 17 anys detingut per agredir dissabte passat un jove d'origen mongol al metro de Barcelona, va començar a compartir vídeos, fotos i comentaris de"
"convergent aclaparadora"". Detenen un lladre per robar joies i aparells electrònics en dos domicilis de Sitges i agredir un mosso Els fets es remunten a la matinada del passat 5 de març, al voltant de les dotze de la nit, quan membres de la Unitat",", un noi de 15 anys resident als Estats Units, va ser detingut per dos policies israelians. El noi denuncia que el vam agredir . Fugen una seixantena de dones i nenes segrestades per Boko Haram Una seixantena de dones i nenes segrestades al juny"
"social, ja que la societat s'oposa majoritàriament, ha considerat. Successos.- Presó per a un home per retenir i agredir sexualment la seva parella durant una setmana Els Mossos d'Esquadra han detingut un veí de Sant Vicenç dels Horts (","davant el Parlament. En algun cas, com estableix la sentència, alguns dels presumptes agressors no només no van agredir sinó que van protegir diputats dels violents colèrics. Admesa l'absència d'autors a qui fer responsables dels fets"
"il·legal, agressió sexual, amenaces i faltes de danys i injúries, després de retenir contra la seva voluntat i agredir física i sexualment la seva parella. Segons ha informat aquest dissabte la policia catalana en un comunicat, l'","moviment dels drets civils dels afroamericans als EUA o del dret a vot de les dones. Al seu entendre, les persones que van agredir i increpar els polítics catalans, representants de la ciutadania, a l'entrada del Parlament feien ""ús de la seva"
", el treball de recerca es fa en coordinació amb la resta de cossos policials. Un membre dels Boixos Nois va intentar agredir Gerard Piqué a la sortida del Nuevo Zorrilla Un grup de Boixos Nois va insultar els jugadors del Barça a la sortida del","hauria estat diferent"". ""Hi ha uns límits, i no es pot anar a assetjar un parlament. Pots manifestar-te, però no pots agredir als parlamentaris"", ha explicat Barberà, mentre s'ha mostrat convençut que ""si això passes amb els del PP o C's, que són"
"els jugadors del Barça a la sortida del Nuevo Zorrilla de Valladolid i fins i tot un dels seus membres va intentar agredir Gerard Piqué llançant-li una moneda. Segons va avançar la Cadena COPE, aquest incident es va produir quan l'expedició",Germà Negre i Txarango actuaran al camp de vol. L'Audiència de Lleida prohibeix l'entrada a Sanaüja a l'acusat d' agredir una mare i el seu fill a la porta de la guarderia del municipi Sanaüja (ACN).- L'Audiència de Lleida ha condemnat a l'
ha quedat arxivat. És una situació que es repeteix en desenes de municipis catalans. Successos.- Mor un home després d' agredir una anciana i la seva cuidadora a Matadepera Un home de 49 anys ha mort la nit d'aquest dissabte a Matadepera (Barcelona),i el seu fill a la porta de la guarderia del municipi Sanaüja (ACN).- L'Audiència de Lleida ha condemnat a l'acusat d' agredir el 9 d'octubre de 2012 una mare i el seu fill d'11 mesos a la porta de la guarderia de Sanaüja (Segarra) a no poder entrar al
"d'horaris comercials. Detenen a Torelló una veïna de Vic per negar-se a fer la prova de l&rsquo;alcoholèmia i agredir els Mossos La conductora, de 50 anys, va negar-se a fer la prova d'acoholèmica i quan els agents li immobilitzaven el","té més potencial de creixement. Accepta 4 anys de presó per intentar matar amb un martell el fundador de JARC L'acusat d' agredir brutalment l'exvicepresident del Canal de Pinyana i fundador de JARC, Pere Vives, va reconèixer els fets en el judici"
"i la fotografia de l'individu que els hi havia passat els Mossos d'Esquadra. En veure's acorralat, l'home va intentar agredir un dels agents, però quan va veure que l'altre policia feia la intenció de treure l'arma reglamentària, va llençar el",", García Mora va ingressar un any a presó preventiva, ja que l'Audiència va considerar que hi havia risc real que tornés a agredir les víctimes. Des del novembre del 2012, l'edil es troba en situació de llibertat condicional i continua exercint la"
". Una defensa dels agents imputats ha assegurat a Europa Press que les dues dones es van resistir als agents i els van agredir , i de fet van ser denunciades per faltes de desobediència i lesions, i absoltes després d'un judici ràpid. Segons ha","legals per a l'ídol adolescent, que posteriorment va ser detingut i acusat de conduir drogat a Miami Beach, així com d' agredir el conductor d'una limusina a Toronto. Potser aquesta sentència podrà influir en els casos de Miami Beach i Toronto,"
". De fet, la majoria d¡assignatures es faran parcialment o íntegrament en anglès. La resta dels nou mossos imputats per agredir quatre joves a Barcelona també defensen la seva actuació El lletrat Juan Carlos Segura ha explicat a l'ACN que els"," i aposta per revisar la forma de treballar"" per a declarar zones turístiques. Condemnen a 1 any de presó la veïna que va agredir l'alcalde de Bescanó quan sortia de casa seva Girona (ACN).- L'Audiència de Girona ha condemnat a 1 any de presó i a una"
"UAB, com ara el Campus Virtual o les biblioteques. Barcelona (ACN).- La resta dels nou mossos d'Esquadra imputats per agredir i vexar quatre joves al barri de Sant Antoni de Barcelona el passat juliol han defensat aquest dijous la seva actuació,","de casa seva Girona (ACN).- L'Audiència de Girona ha condemnat a 1 any de presó i a una multa de 225 euros la veïna que va agredir l'alcalde de Bescanó el març del 2012. Antonia Sánchez ha admès que aquell matí va esperar Xavier Soy davant casa seva i,"
"de companys que van declarar al jutjat d'instrucció que investiga el cas. Els agents han assegurat que en cap moment van agredir les noies que van arribar a la comissaria de Les Corts, però tampoc saben explicar les importants lesions que","a 14 anys i 10 mesos de presó per homicidi. La defensa, en canvi, indica que Fortuño va enxampar la víctima intentant agredir sexualment la seva parella i això va ser el detonant de la disputa. A més, apunta que l'acusat està ""malalt"" com a"
per Alba Ventura. El concert ha comptat amb la presència dels Prínceps d'Astúries i de Girona. A presó un home acusat d' agredir sexualment tres dones Un home ha ingressat a presó després de ser acusat d'agredir sexualment tres dones a Barcelona.,"ganivet de cuina i va apunyalar la víctima fins que l'arma es va vinclar. Després, va anar a buscar un altre ganivet i el va agredir fins a la mort. La víctima va rebre 59 ferides. Radiodiari Migdia - Balears 09/06/14 Programa d'esports. Rafel Nadal"
i de Girona. A presó un home acusat d'agredir sexualment tres dones Un home ha ingressat a presó després de ser acusat d' agredir sexualment tres dones a Barcelona. Les tres víctimes no recorden res però se les va trobar despullades al mig del carrer,"el pont del Pelut el vehicle va ser interceptat. El conductor del vehicle, C.M.R. de 27 anys i veí de Torelló, va intentar agredir un agent, per la qual cosa va ser detingut. Se li imputen els delictes d'atemptat als agents de l'autoritat, conducció"
del comitè corresponent per prendre una decisió definitiva. La fiscalia demana fins a 3 anys de presó per a 2 acusats d' agredir l'alcade i un regidor de Puigverd d'Agramunt Lleida (ACN).- L'Audiència de Lleida jutjarà dimecres 26 de març dos,Mossos d'Esquadra han obert una investigació per localitzar dues noies que la passada matinada de dissabte van robar i agredir un ciutadà anglès de 81 anys a Castelló d'Empúries. Els fets es remunten al passat divendres quan la víctima va conèixer
"regidor de Puigverd d'Agramunt Lleida (ACN).- L'Audiència de Lleida jutjarà dimecres 26 de març dos joves acusats d' agredir l'alcalde i un regidor de Puigverd d'Agramunt (Urgell) la matinada del diumenge 16 de setembre de 2007, durant la festa","i es van desplaçar a un descampat del municipi. Segons la versió de la víctima, allà va ser quan les dos dones el van agredir i es van emportar els seus pantalons i el cotxe. Un ciutadà va localitzar la víctima aquesta passat dissabte a les set del"
"la setmana passada a la Ciutat de la Justícia i van defensar la seva actuació. Els agents, que estan imputats per agredir i vexar aquests joves al barri de Sant Antoni de Barcelona el juliol passat, van assegurar que en cap moment van agredir","amb elles, es van desplaçar tots tres en cotxe a un descampat del municipi. Va ser allà on les noies el van començar a agredir i li van robar els pantalons i el seu vehicle. Una persona que passejava per la zona de Bernat de Baix aquest dissabte al"
"agredir i vexar aquests joves al barri de Sant Antoni de Barcelona el juliol passat, van assegurar que en cap moment van agredir les noies. Últim pas per a l'aprovació del PDU del Centre Direccional-Parc de l'Alba de Cerdanyola Barcelona (ACN).-","que la matinada del 24 de febrer del 2012, a les portes del local, diversos homes se li van tirar a sobre i el van començar a agredir . ""Mai m'hauria pensat que acabés així, amb algú mort"", ha afirmat l'acusat que diu que l'únic que va fer va ser intentar"
"fill, l'Alzheimer que pateix des de fa més d'una dècada havia avançat molt i el seu estat és terminal. Detingut a Vic per agredir el company de Vic La víctima presentava ferides a la cara i al braç pels efectes d'una arma blanca. Va ser traslladat a l'",Tarragona (ACN).- Els Mossos d'Esquadra han detingut quatre membres d'un grup d'ideologia nazi per extorsionar i agredir un veí de Tarragona per pagar la defensa dels acusats del cas Stroika de Manresa que actualment es troben a la presó per
"de puta, que no sabeu fer res a l'ajuntament i vau posar la planta de compostatge o alcalde de merda"" i tot seguit els van agredir . Primer els dos acusats van propinar diverses puntades de peu a l'alcalde i un d'ells també un cop de puny a la cara;","del ""cas Stroika"" Els Mossos d'Esquadra han detingut quatre membres d'un grup d'ideologia nazi per extorsionar i agredir greument un veí de Tarragona. Dos han ingressat a la presó. El seu objectiu era aconseguir diners per pagar la defensa"
"un delicte de resistència i 6 mesos més per un delicte de lesions. En el seu cas, haurà d'indemnitzar el regidor a qui va agredir amb 6.800 euros. A la sortida del judici, l'advocat de l'alcalde i regidor, Carles López, ha afirmat que els dos acusats","el 23 de març passat, dues hores abans de l'inici d'un concert antifeixista. Un grup de joves d'ideologia neonazi van agredir greument un grup de joves d'estètica oposada i les investigacions posteriors van portar a la detenció i imputació de"
"vegades en no desviar el focus de la responsabilitat dels incidents registrats, en al·lusió als grups violents que van agredir els policies. Sobre la presència d'observadors de l'Organització per a la Seguretat i la Cooperació a Europa (OSCE),",", Jared Mortimer, ha explicat que Pistorius, aquests dies immers en el judici per l'assassinat de la seva nòvia, el va agredir després d'insultar-lo i insultar el president del país, Jacob Zuma, i la seva família. L'incident ha estat confirmat"
"víctima, en canvi, ha negat haver robat res, ha assegurat que va pagar el mes de lloguer i ha dit que no entén perquè la van agredir . Segons ha explicat, el 26 de gener de 2011, ella tornava de treballar del barri Pardinyes, on cuidava una dona gran, i es","TV3, l'Audiència de Barcelona qualifica de reprobable i desproporcionada l'actuació del mosso que va ser jutjat per agredir David Fernández, de la CUP, en el desallotjament dels indignats de la plaça Catalunya fa 3 anys. El subinspector havia"