"de l ́equip, o millor dit, era, perquè pareix que no tornarà mai més a ser-ho, si més no en el València CF. Em resulta curiós fullejar el ́Superdeporte ́ i vore a Enzo i Parejo amb els xiquets de ́ASINDOWN ́ en la promoció del seu calendari i a continuació","a Sant Jordi a la Biblioteca Xavier Amorós. En total, són 112 llibres que s'han gestat en el darrer any i que es podran fullejar fins el proper 30 d'abril. ""Amunt persianes"", el pla de Barcelona per reactivar els locals comercials buits L'"
"convida el visitant a treure's les sabates i entrar a l'habitacle, suaument enconxat perquè sigui confortable, i fullejar els gairebé 200 llibres que hi ha als prestatges, tots folrats amb una portada comuna. Cadascun dels volums té a la",". Encara que fos divendres, encara que el dia ja hagi passat, segur que us queden llibres per comprar, per buscar, per fullejar , per espigolar... Aquest llibre és breu, molt breu, té escasses setanta pàgines i es llegeix d'una revolada, amb mitja"
"de cent llibres de receptes. Les vacances les sol passar caminant per la muntanya. Les seves úniques frivolitats són fullejar Vogue -on apareixerà en l'edició americana de març- i col·leccionar sabates vistoses, que formen part de la seva senya","un exercici senzill: quan a principis de maig la primavera es desboca i hi ha un augment sobtat de temperatura, cal anar a fullejar Les hores, volum 20 de l'O.C. planiana, buscar el capítol dedicat a l'època de l'any en la qual som i comprovar què diu el"
"aquestes empreses que prefereix el digital"", explica l'emprenedora. ""No crec que mori mai, a la gent encara li agrada fullejar i encerclar les ofertes en el paper"", raona. De fet, dels comerços amb els quals treballen els clients estrella són els","la seva visita virtual de 360o i descobrir el primer palau urbà dissenyat per Antoni Gaudí. A més, des del seu web es poden fullejar i comprar tots els llibres de la col·lecció ""El Palau Güell a fons"". Després d'una bona passejada per les rambles, i"
"perquè són llibres que no aguanten. Els nens d'ara són diferents. Si vols que aquest nen ho apagui tot i dediqui un temps a fullejar un llibre, si és del 96 no ho aconseguiràs. -- Quin consell donaríeu a uns pares a l'hora d'animar els seus fills petits a",". Aquest Sant Jordi, dia de roses i llibres, els catalans sortiran al carrer, el que es pugui per motius de pandèmia, a fullejar , comprar i esperem que després, llegir, tant com puguin. Però aquest 23 d'abril, a banda de llegir novel·les o assajos,"
"cuina i fotografies i frases d'escriptors, i si preferiu prendre un margarita o una aigua de tamarinde a la barra, podeu fullejar les últimes novetats de l'editorial. MÉS INFORMACIÓ A la recerca del gust més 'canalla' Modernisme a les papil·les","recinte, s'han format cues de més de 30 minuts per tal de regular l'aforament. Molts dels compradors han celebrat poder fullejar llibres amb tranquil·litat, com és el cas d'en Pau i l'Eli: ""Ens agrada més que s'hagi ubicat aquí que a la plaça Mercadal"
". No cal dir que aquesta persona es troba en la categoria d'home bo. En els mateixos dies, i com que no puc evitar fullejar i tafanejar tots els diaris d'allí on em trobi per tal d'assabentar-me de què passa en l'entorn que m'envolta, els meus",". La regulació de l'aforament al recinte ha comportat cues de més de 30 minuts, però també ha permès als visitants poder fullejar els llibres amb tranquil·litat. ""Ens agrada més que s'hagi ubicat aquí que no pas a la plaça Mercadal. Es podria"
"Brothers, torna a Barcelona. Bufarà la seva històrica harmònica avui i demà al Jamboree (20.00 i 22.00 h). L'he vist fullejar anuncis de 'tablaos' de flamenc, quan he arribat per entrevistar-lo. El flamenc és com el blues. Camarón, per exemple,","pol d'atracció entre el públic, que, fins i tot, on altres anys regnava la llei del més fort per fer-se un espai i poder fullejar alguns exemplars, enguany eren els mateixos clients els que s'ajudaven a localitzar el volum entre els centenars de"
"que exhibeix una cèntrica trattoria de Bolonya, on a més de dinar i sopar delícies tradicionals els clients poden fullejar algun dels centenars de llibres de les prestatgeries. Bolonya és una ciutat on la cultura literària no és precisament","la gorra que algun els deixava amb infinita paciència. Els més tranquils podien seure al sol mentre els seus pares fullejaven la premsa, i llegir contes seleccionats per a l'ocasió, com La carretera bona , de Joan Barril, que els il·lustra com n'"
"va rebre, de mans del meu malaurat amic Oriol Canals, un llibre sobre tifes: impertèrrit, professional, Pujol el va fullejar i va dir que el trobava ben interessant. Enllà de bromes, el Berenar Literari congrega autors mediàtics i autors que no",", una quimera del tot inabastable sota l'imperi de Twitter i la dictadura del dúplex televisiu. Dimecres, mentre uns fullejaven diccionaris per salvar el coll, d'altres cridaven a prendre els carrers per enderrocar el president ""il·legítim i"
"tocar, quines cobertes els van sorprendre detectant les seves emocions, quines sensacions transmetia la seva cara en fullejar les pàgines i quines expressions van transmetre en comprar els llibres suggerits. Els experts en reconeixement","Urbana insten els ciutadans a tornar a casa tot advertint que no poden romandre a la via pública Tres senyors grans fullejaven diumenge al matí, cap a les 9.30, un diari a les cadires individuals de la Rambla, just al davant de la Font de Canaletes."
"mateixos: un catàleg de comportaments vergonyós, prejudicis, pedanteria i baixesa moral que és impossible fullejar sense sentir una incomoditat estranyament gratificant. Tot un èxit que s'assenta en les portentoses","un esperit de veïnat molt característicament terrícola. A la plaça de la Vila de Gràcia, el Joel i el seu fill Bartomeu fullejaven diversos llibres il·lustrats davant la porta de la llibreria La Memòria: ""Els volia comprar per Amazon, però he vist"
", va haver de sortir en l'era d'Obama, però va acabar sortint en l'era de Trump, quan solo has d'encendre la televisió o fullejar un periòdic per veure infinits exemples de masculinitat tòxica. Està per tot arreu. No és solo gent violenta, o gent que",època de la meva infància eren molt pomposos Un dels temes més recurrents al bar era el dels difunts del dia. Els clients fullejaven el Diario Español per veure les esqueles i l'hora del funeral. Era aquella Tarragona on ens coneixíem gairebé tots.
"les llicències de l'escorxador"". El llibre de la història de la Molina es presenta a Puigcerdà Puigcerdà podrà fullejar a partir del proper 23 de març el llibre que recull la història dels 75 anys de funcionament de l'estació d'esquí de la","situació ""normal"" i el màxim de semblant a la que hi havia abans de la irrupció del coronavirus. Els bessons berguedans fullejaven aquest cap de setmana els llibres que utilitzaran aquest curs, tot curiosos per saber què aprendran en aquesta represa"
"seva primera diada com a escriptora. ""Era el 2005 i signava al costat de Joan Margarit. En un moment que no teníem gent va fullejar el meu llibre i em va dir: ""Tu continua escrivint i no facis cas de tot això"""". L'escriptora, que publica Mare de llet i mel","tancament la setmana que ve, molts lectors van omplir llibreries cèntriques com Laie i La Central. N'hi havia que fullejaven la poesia completa de Federico García Lorca. D'altres buscaven títols connectats amb el present, com el catàleg de"
", perquè el llibre va caure a les meves mans -de fet, hi va ser posat amb males arts- a la part baixa de la Rambla, el vaig fullejar mentre pujava pel passeig, temps més que suficient per adonar-me de la qualitat, i va acabar en una paperera a la part",") Diuen que en els temps foscos del tardofranquisme, tots els progres llegien l'Hola d'amagat. Potser només la fullejaven per sobre, per passar l'estona, o potser, qui sap, s'adelitaven contemplant aristòcrates, actrius o toreros, els"
"promoure la lectura en la llengua del carrer i del poble, ara que Franco havia mort. Aquell dia hi havia un motiu de pes per fullejar llibres diferents dels del fons de la biblioteca local i comprar-ne un. Sense necessitat d'estar malalt. Nous","una dotzena d'espais per evitar aglomeracions. De capvespre, però, s'han acumulat molts de visitants que cercaven, fullejaven o badaven. Enguany, una gran quantitat d'autors han gaudit del contacte amb el lector en una diada amb més novetats"
"el focus en tot allò que els fa extraordinaris.""El llibre és ideal per a temporades de platja i de viatges, perquè es pot fullejar anant endarrere i endavant, sense haver-lo de llegir cronològicament. I a mi em va molt bé per a la funció, ja que l'","a parlar-te dels teus comentaris als meus poemes, i seguiré el teu mateix ordre. 'Mort i transfiguració': No, no he fullejat pas cap edició de l'Enciclopèdia. Tu et vas adonar, un dia, que havies --fins llavors-- pensat poc en la mort. Et"
"que la de los ríos. Y debe ser muy salada "", escrivia Anita Ortiz en un d'aquells quaderns, que per primera vegada es poden fullejar i llegir tots en una sola exposició. Unes grans caragolines amb uns altaveus amagats permeten escoltar, en veu d'un",", assegut a un sofà i amb un cigar a la mà. També hi havia un exemplar del llibre-CD d''Enclusa i un cop de mall' que ha fullejat com si recités alguns dels versos inclosos en aquest últim treball i un telèfon vermell que ha sonat entre cançó i cançó,"
"espai, com a novetat, s ́incorporen les noves tecnologies. L ́espectador, mitjançant una pantalla tàctil, podrà fullejar dos dels magnífics atles de la col·lecció: un d ́ells és Les plans et profils des principales Villes et lieux","en la generalització dels estius amb el cau, sinó que apunta amb decisió una d'entre les nombroses travesses fetes. Ha fullejat els àlbums de fotos i n'ha triat una, la que il·lustra aquesta pàgina, en una aturada a la muntanya. ""Jo devia tenir 15"
"cosa que hauries de fer, il·lús aspirant a visitar el que queda d'aquesta Barcelona que s'enfonsa en el passat, és fullejar un llibre de fotografies antigues (com ara aquest). I observar bé les imatges del carrer de Trentaclaus (avui Arc del","la manicura, massatges... Aquesta vegada, hi ha anat acompanyada d'una amiga i la seva filla. Durant la sessió, ha fullejat les revistes 'People' i 'Vogue'. Després de sortir del saló de bellesa, on ha anat gairebé sense maquillar-se, l'"
"distribució, l'hàbitat i algunes observacions específiques relatives a la seva alimentació, longevitat o hàbits. Fullejar el llibre, o consultar una dada concreta d'un animal, serà un veritable plaer per a petits i grans, que es podran","l'Ictini: Diccionari de Ciències de la Societat editat per Edicions 62. És allò pitjor del pitjor. A qui no l'hagi fullejat li aconsello que ho faci. És l'equivalent t a l'Enciclopèdia Soviètica dels pitjors temps. És un immens pamflet, cent"
"activitats del festival. Aquest espai no disposa de servei de bar. Una selecció de llibres adreçat a totes les edats per fullejar , descobrir i compartir lectures. Marta Barberà està darrere de 2nd Funniest Thing, un projecte conscient i juganer.","butaques de pell de la sala estan lliures i m'assec en una d'elles, disposat a llegir aquell material que de moment he fullejat a peu dret. Sóc capaç de concentrar-me uns quants minuts -potser cinc- en els documents escrits en llenguatge"
"començar sent una broma, però cada dia estic més convençut que no va gens desencaminat. Amb més temps de l'habitual per fullejar , mirar i escoltar notícies és evident que el millor que un pot fer per no acabar malament del terrat és desconnectar. A","l'autobús, fent cua a qualsevol banda), uns Punts de meditació amb una bona amanida d'articles dels anys vuitanta. I he fullejat carpetes d'aquelles que guardes en un pilonet i que un dia (re)trobes i que t'ofereixen perles en forma d'aforisme o"
"en un estímul"". Una entrevista de poca altura a Drew Barrymore Els passatgers de la companyia Egypt Air que van fullejar la revista de cortesia que s'ofereix en els vols es van quedar de pasta de moniato quan van llegir l'entrevista que feien","de l'ANC i Òmnium Cultural. L'acte proposat ha estat una Tintinada, on ""els servidors públics de la Generalitat hem fullejat els còmics d'Hergè, molt representatius de la cultura belga i europea, així com obres de Peyo (Jan i Trencapins o els"
"a Els coloms de la Boqueria, pocs dies després dels horribles fets de la Rambla barcelonina, un fet cotidià. Només has de fullejar els diaris. Ahir el llibre es va presentar (vaig tenir la satisfacció de ser convidat a intervenir) a la Llibreria 22 de","en la seva educació. La premsa alemanya, davant l'extradició de Puigdemont només per malversació Si Donald Trump ha fullejat la premsa alemanya aquests darrers dos dies, el que ha vist segurament no li haurà agradat: el president d'una"
"i, sobretot, per pixar-la. Amb el temps he descobert que una cosa és tan important com l ́altra. M ́ha impressionat fullejar el llibre que pòstumament s ́ha editat sobre la seva feina. Pep Iglésias. Anacronismes 1978-2009. Unes fotografies","ultres escridassen contra els drets, la democràcia emmalalteix, al menys la del s. XXI, la que volem els catalans. Hem fullejat els actes de les Gales 2018. Tant la programació com la seguretat d ́aquests actes són competència de les regidores"
"Plata, però les activitats de La Plaça del Llibre continuaran fins diumenge, obertes a tothom que vulga acostar-se per fullejar , si més no, eixos petits bocins de memòria amagada entre les pàgines dels llibres. El Canyamelar, independent del","no llegiran aquestes línies impreses. I si ho fan, serà perquè la seva mare o el seu pare han comprat el diari i ells l'han fullejat . Llegiran la versió en digital d'aquest reportatge -no us la perdeu!- que els haurà arribat per WhatsApp o per alguna"
"Simplement, persones sàvies que van escriure sobre la pròpia infància, senzilla. M'hi vaig asseure, i vaig començar a fullejar el llibre. Aquí hi eren, escrits en primera persona, els retalls, els records d'infància de Miguel Delibes, de Herman","l'Holocaust, explica Annette Hess (Hannover, 1967), coneguda guionista televisiva alemanya, poc després d'haver fullejat alguns dels expedients del judici que es conserven a l'Arxiu de l'Estat de Hessen, a Wiesbaden, a 40 quilòmetres de"
"evitant innecessàries manipulacions que poden afectar la conservació de les obres que al seu dia van llegir i van fullejar només reis i reines, papes o emperadors. Al costat del 'Beat de Girona' obren la mostra unes altres dues rèpliques","subvencionades, del poeta. És obvi que el pensament si no és eròtic no és pensament, això ho sap qualsevol que hagi fullejat els clàssics. D'altra banda, avui dia fins i tot el lector català més talòs és conscient de quina càrrega política"
"d'Adrien Grant Smith Bianchi i Jules Gaubert-Turpin és un deliciós, amè i didàctic viatge pels països productors Fullejar 'La carta de vinos, por favor' (Cinco Tintas) és com tornar a aquells anys d'EGB i les classes de Socials, quan","mínimament per entrar-los a la base de dades dels llibres, revistes i altres paperots que tinc a casa. També els he fullejat però la feina d'entrar exemplar per exemplar a estudiar el seu contingut -i, sobretot, comparar el to i la tria de les"
"que cada placa de marbre tingués un significat, un perquè i un sentit. El que vulgui ampliar aquesta matèria faria bé en fullejar el llibre 'Història dels carrers de Sant Andreu del Palomar', de Jordi Petit i Jordi Sánchez. Es van passar quatre anys","cinemes que freqüentava, com el Rex, l'Excelsior o el Condal. També va pensar en les revistes com Esquire, que havia fullejat al Mercat de Sant Antoni, una escletxa de possibilitats enmig del chapapote del franquisme. Amb el treball d'aquestes"
"l'Estat està seguint contra l'independentisme català té els peus de fang. I no és que disposem d'un oracle. Només cal fullejar quatre llibres d'història, de literatura, i assabentar-se una mica de les trifulgues semblants, d'ara, arreu del món","d'un llibre, d'una conferència o del que sigui. No he llegit cap llibre de Thomas Piketty, ho confesso. I només he fullejat algun exemplar de les obres del famós filòsof Slavoj Žižek. Sempre que vull recuperar el debat sobre la desigualtat o el"
"que inclouen l'importantíssima Medalla Kate Greenaway, l'Smarties Book, el Book Award..., entre d'altres. Podreu fullejar els seus llibres en qualsevol llibreria o biblioteca especialitzada. Cal, tanmateix, destacar-ne alguns. El rei Jan",", explicant els fets de la tardor de 2017, hem recordat els valors de la feina ben feta. Rigor i criteri professional. He fullejat Una España mejor, el llibre que va publicar Mariano Rajoy a finals del 2019. No apareix, enlloc, a la llista de més venuts"
", era per a Marià, així que aquest matí, després de recollir-lo a la impremta, vaig cap a ca seua. Em demana que li deixi fullejar la revista, mentre jo don un repàs als titulars de l'exemplar del dia de La Vanguardia. Pensem que és el primer número en","retards, mancances, horaris i canvis. Jordi Sánchez torna a Lledoners després del seu primer permís Abans d'entrar ha fullejat un llibre d'autoria bagenca sobre l'activitat al pla de Lledoners, ""Una finestra al món"" Sànchez ha retornat a la presó"
"de conservació, i produeix cert efecte imaginar que algun dels membres de l'equip, o la mateixa Sandy, el van arribar a fullejar durant el rodatge. El cas és que Cinta Pujal, la conservadora dels fons cinematogràfic de l'Arxiu, ha reconstruït al","portes del centre ha rebut crits d'ànim i de ""no esteu sols"" de persones que s'hi han congregat. Just abans d'entrar ha fullejat un llibre d'autoria bagenca que acaba de veure la llum i que li han lliurat allà mateix, Una finestra al món, que és un"
"acte de lliurament dels premis, Roma va agrair el guardó i va recordar la seva estreta relació amb Joan Amades des que va fullejar un exemplar del seu pare del Folklore de Catalunya. A l'acte va intervenir el director de cultura de proximitat de l'","Herrera, tots dos receptaris regal de boda d'alguna tieta en l'òrbita de la Sección Femenina, mai no els han ni tan sols fullejat . En línies generals, els pijos no han demostrat cap tipus d'interès o destresa a l'hora de cuinar i han deixat en mans de"
"dels nostres dies. Avui preferim seure sols al tren i aïllar-nos amb uns auriculars en comptes de mirar la finestra, fullejar un llibre o un diari, o tan sols observar curiosament la resta de passatgers que entren i surten accelerats. Avui vivim","pròxim, ni que sigui en una gasolinera. Necessito certificar que el diari és al carrer per ser comprat i llegit més que fullejat , perquè la informació costa diners, cosa que convé recordar. L'edició impresa, o en PDF, ha de ser una opció i una"
"Deliri, ignorància, bordegassos? He romàs uns quants dies ingressat a l'hospital... i allí tens temps suficient per fullejar diaris d'ací i d'allà, la qual cosa em xifla, perquè sense diaris sí que sóc home mort He romàs uns quants dies ingressat","les vostres dues signatures"". Més enllà de la càrrega metafòrica i de l'espot promocional, no sé si és una bona idea. He fullejat el de Puigdemont i puc afirmar que la dosi de rancúnia i animadversió cap al líder d'ERC és notabilíssima, tant que obre"
", i allí més enllà de pensar i repensar en la vida, en la mort..., i en altres bestieses, tens temps suficient per fullejar diaris d'ací i d'allà, la qual cosa em xifla, perquè sense diaris sí que sóc home mort. I no perquè em cregui tot el que",es dibuixa una Marta Rovira molt emprenyada quan es convoquen eleccions el 2017. Plantant cara. Us hi reconeixeu? -- He fullejat alguns d'aquests llibres i articles. Però tinc controvèrsia personal. No vull que m'alterin la meva memòria. Jo també
"vergonya el que 50 anys enrere acceptàvem amb normalitat; la pressió social té això, canvia les coses Tinc el costum de fullejar un parell de diaris a l'hora de l'esmorzar. Diuen que és millor fer les coses una darrere d'una altra. Sembla que","no comprometré ningú. El president Puigdemont l'ha llegit? No ho sé. I vostè els seus? El primer sí que l'he llegit, i he fullejat el segon. De fet, la reacció que em va provocar la lectura del primer llibre va ser la de presentar, també, les nostres"
"després de la Segona Guerra Mundial, amb el model de suburbis dels EUA, hi va haver una regressió. Es manté? Sí. Només cal fullejar una revista per a dones: has de ser professional, la més guapa, la millor al llit, la millor mare... Ho pots fer tot, però","mare, no eren cananes!) tallats ben petitons (amb l'edat he criat paciència...). Mentre es rossegen, he fet el cafè, he fullejat el diari i he descobert una gata que regala a Ponç Pons cinc decasíl·labs acabats d'arrencar de l'hort. Trec els"
"ser el 28 d'abril del 2008, mentre feia cua a la llibreria Dalmau de Piera. Aquest escriptor i professor de secundària va fullejar la revista Sàpiens i es va sentir encuriosit per un article sobre les fosses comunes a Catalunya. Encartat amb la","de milions de visites. ""Jo no he vist aquest vídeo, perquè no tinc temps per veure aquest tipus d'informació, però he fullejat les compilacions del vídeo que m'han portat els meus ajudants; res del que es declara allà em pertany o em va pertànyer,"
"culinari, el treball d'elaboració del llibre va estar encaminat a crear un producte ""bell"" i que ""agradi i que el puguin fullejar fins i tot els que no els plau cuinar"", anota la Beth. ""En aquest Nyam! hi hem posat molt d'amor"", certifica la cantant: ""","que li pertoquen. Però tampoc en té tants que no puguin ésser, en la part diferencial, única que pot interessar-nos, fullejats en una hora. Les redaccions es troben totes a menys d'un quilòmetre de la Plaça de Catalunya. La majoria dels que"
""" La ressaca és un procés que es produeix en el nostre organisme després d'un excés en el consum alcohòlic. Un dia vaig fullejar un llibre de cert gruix intitulat Remedios para la resaca. Res, inútil. Tots podríem explicar (uns més que menys) les","passa. Llistes dels més venuts, cares d'escriptors mediàtics i massa llibres amuntegats a les cases que a penes seran fullejats . Però així és el món i l'èxit costa molt discutir-lo. Per això els llanço aquest consell: surtin a comprar un llibre avui"
. El fiscal reclama 14 anys i 9 mesos de presó per a Millet i 10 anys i 10 mesos per a Montull. Ausiàs March de nou Tocar i fullejar un exemplar bibliogràfic del segle XVI comporta sempre una certa emoció a qualsevol amant de la literatura. Quan el,"xarxa corrupta. Però admetre que se saben segons quines coses, que s'han llegit segons quins informes (alguns no només fullejats a Génova, també els que ha publicat la premsa) pot comportar greus conseqüències, i per aquest motiu Rajoy ha optat per"
"aquell lloc i hi comprava llibres que devorava. I això que els botiguers no l'hi posaven fàcil. Estava prohibit fullejar els llibres, per tant, es veia obligada a triar-los a l'atzar. De mica en mica, aquesta limitació es va convertir en un","la sobredosi de thrillers que inunden les nostres llibreries, aquests llibrots de 600 pàgines es limitaven a ser fullejats per un servidor i a ser retornats al seu lloc, substituïts per alguna cosa de menys pes. Quan les tres primeres aventures"
"sentimental després de trencar amb la seva parella, Ryan Thomas. Pasqual Maragall reviu els seus Jocs L'exalcalde va fullejar el suplement olímpic d'EL PERIÓDICO amb l'ajuda de la seva excap de premsa Una entranyable imatge ha solcat les últimes","cap lectura dels filòsofs no penetrarà dins meu per canviar-me. Per això hi ha tants de llibres oberts damunt la taula, fullejats , tancats de cop massa aviat amb algun poema que serà capaç d'il·luminar-me més o menys temps com les entrevisions de la"
"reals o va ser, com creiem uns quants, una efectiva operació de guerra psicològica. Per desxifrar el 155 he decidit fullejar un llibre sobre numerologia, una ciència metafísica tan creïble com el tarot o la quiromància, però tan o més rigorosa","aquí no ve buscant això"". I és cert: la majoria dels llibres que veig quan entro a la tenda no estan en cap dels TOP20 que he fullejats les últimes setmanes. Quin goig que hi hagi espais encara on la consciència pesa més que la butxaca. 17.35h I el català"