"superiors a les habituals a bona part del continent europeu, també en aquest àmbit. Les oportunitats de veure nevar aquesta tardor també han anat comptades. Als Alps francesos, a tall d'exemple, la neu es escassa en general i s'ubica","que algunes precipitacions acabin coincidint amb l'onada de fred, que ja estarà en remissió. Si això passa podria nevar a cotes més baixes de les habituals. Una possibilitat que, de moment, no inquieta la conselleria, que ha activat el pla"
", i entre els 60 i 80 cm al nord, uns valors que varien però en funció del massís. Ben poques són les possibilitats de veure nevar al Pirineu abans del dia de Nadal, tret d'alguns flocs anecdòtics a les cotes més altes procedents dels fronts","caure en cotes molt baixes, i finalment ha estat així. Almenys de moment. Poc abans de les cinc de la tarda ha començat a nevar sobre la ciutat de València, tal com es pot veure en els vídeos i imatges difoses a través de les xarxes. Segons l'Agència"
"el darrer dia del 2015 ens portarà el darrer canvi de l'any a de la mà d'un segon front, que possiblement farà ploure, o nevar , en alguns indrets de Ponent i el Pirineu entre la tarda i la nit de Cap d'Any. El primer dia del 2016 s'entreveu tranquil,","i conduïu un vehicle pesant, recordeu que: Arriben les hores més dures de l'onada de fred: on en farà més? On pot arribar a nevar ? Durant el dia d'avui s'han registrat nevades en diferents punts de tot el país, com al Pirineu, València i la serra de"
"al nostre estiu, que és quan arriba el seu hivern. Recordo que plovisquejava i feia fred, però no va arribar a nevar . ""Pensa que el Nadal cau en ple estiu a l'hemisferi sud, i la imatge clàssica del Pare Noel, de la neu i dels avets","en 26 edicions disputades, una hegemonia indiscutible. Les previsions meteorològiques auguraven que ahir havia de nevar al País Valencià i a les Illes Balears i finalment els pronòstics es van complir. A les Illes la nevada va ser força"
"d'immigrants irlandesos van decidir muntar un Nadal pel seu compte al poble de Katoomba quan van veure que es posava a nevar al juliol. Van improvisar un sopar amb gall dindi, púding i bon vi, i fins i tot es van disfressar de Pare Noel. Els anys","cota de neu que no es dispararà a l'alça, sinó que es podria moure entre els 500 i els 1000 metres. Diumenge podria ploure i nevar de forma més extensa, tot i que sempre les probabilitats més altes es concentren novament entre les comarques de Girona"
"l'esforç, escoltin el concert per primer cop o repeteixin l'experiència una tarda mentre llegeixen un llibre o veuen nevar des de la finestra. Keith Jarret en estat pur, per més que ell mateix mai s'hagi considerat lligat a un concert, perquè","a ennuvolat o cobert. En la meitat sud algunes precipitacions febles. La cota de neu baixarà fins a 100-200 metres, i pot nevar en qualsevol cota, tot i que apujarà fins a 300-400 metres. Les temperatures aniran en descens i es registraran gelades"
"de l'Andros. ""Ha estat un dels anys més tranquils, entre cometes, en la preparació de l'escenari de la prova. Va nevar quan ho havia de fer, a finals de novembre, i després va fer fred. Malgrat tot, si les temperatures haguessin estat una","Alcoi està intransitable en el punt quikomètric del 792 al 792.5 A la comarca de la Vall d'Albaida no és tan inusual veure nevar . Amb tot, encara sorprenen imatges com aquesta fotografia que han fet els campaners d'Albaida. L'agència estatal de"
"local, preferentment cap a la Garrotxa, l'Alt Empordà, la Selva, el Vallès Oriental i l'Alt Maresme. Podria arribar a nevar una mica a la part més alta del Montseny. Paral·lelament es mantindrà la nevada feble a la cara nord del Pirineu per sobre",", a set quilòmetres de l'epicentre actual, i va deixar 298 víctimes mortals. En les últimes 36 hores no ha parat de nevar a la zona i les comunicacions, ja de per si complicades pels anteriors sacsejos, encara s'han tornat més difícils. Els"
"de Girona va haver-hi alguna emblanquinada. Des de Vallter informaven via Twitter que durant la tarda havia començat a nevar fort; el mateix deien des de la Molina, que destacaven que la neu començava a quallar en totes les seves cotes i des de","talla. El progenitor ha explicat a Europa Press que la idea d'esquiar li ronda de fa molt, ja que en 1982, quan també va nevar en la localitat, no va poder, així que des d'ahir, quan es van conèixer els avisos de la baixada intensa de temperatures i"
". Tal vegada Ses Majestats els Reis d'Orient... Ara recordo amb nostàlgia aquella primavera de fa uns anys que va nevar per Pasqua... Recordo també el Sr. Manel Anglada, persona generosa i entranyable, a qui vaig dedicar aquest petit",", que s'ha alçat a les cinc de la matinada però ha hagut d'esperar fins a les 6.30 hores per a veure que començava a nevar i que anava quallant pel que ha decidit anar a casa d'un amic perquè li deixara esquís, encara que al final solament han"
", fa fredot i neva tant com pot! encara que, si vols que et digui, aquestes volves no posaran. Has vist quina manera de nevar , Marieta? -Prou que ho he vist, però el que ara estic veient és que portes la gorra cafida de neu i que si no et canvies de","que Olaizola no podrà alinear a Reus. Després de la gran nevada, seguirà el fred. Els propers dies pot ploure i tornar a nevar a cotes altes. El Celta tomba el Madrid al Bernabéu Després de 40 partits sense perdre, dues derrotes consecutives. El"
"rialla còmplice, surt de la cuina, obre la porta i enfila cap al Carrer Gran. -És ben boig aquest temps. Cremat! Mira que nevar per Pasqua! N'hi ha pels més valents, s'exclama la Marieta. -Encara neva? demano mentre aixeco la vista del diari. -No","alertades. L'avís per neu és del grau més baix, 1 sobre 6. Segons el Meteocat la nit de dijous a divendres podria arribar a nevar fins als 400 metres, però amb el pas de les hores la cota de neu s'enfilarà fins als 900. Més enllà de la neu, el vent i l'"
", segons el tècnic Marc Gutiérrez, que afirma que ha estat guerrera"". A la segona mànega, per contra, ha començat a nevar i la pista s'ha fet molt complicada, amb la qual cosa hi ha hagut molts abandonaments. Tampoc no ha acabat aquesta mànega",", Toni Francès, la tempesta s'esperava per a la nit de dimecres a les 22.00 hores, però s'ha endarrerit i no ha començat a nevar fins a les 6.00 hores del matí de dijous. Això ha provocat que molts veïns hagin optat per utilitzar els seus vehicles i"
"canvis. No serà un front gaire actiu, en general només aportarà núvols prims, però al Pirineu Occidental hi podria nevar dissabte a primera hora. Més enllà d'aquest front els mapes a llarg termini dibuixen dues coses bastant clares: la","hores d'intens treball per part dels equips de rescat i enmig de condicions adverses, tot i que durant la nit ha deixat de nevar a la zona. Per ajudar en les tasques de rescat s'ha demanat l'enviament de cinc helicòpters dels bombers que es troben en"
"del que s'esperava, ja que no es preveia fins a primera hora de dissabte, però durant la nit de divendres ja va començar a nevar a la ciutat. Iceta celebra que Podem retiri les ""línies vermelles"" El primer secretari del PSC, Miquel Iceta, ha","d'accés a la població, el de Torre Miró i Querol. El responsable municipal ha detallat que a Morella va començar a nevar ahir dijous al voltant del migdia i que este divendres continuava fent-ho cap a les 11.00 hores, de manera que es poden"
"de Dalt 46. Les dades aguanten clarament la comparació, i ens situen en un escenari no gaire diferent. On més va nevar en aquell episodi va ser al Vallès Oriental, a Granollers es va arribar al metre de neu i a Martorelles als 110",que es va espatllar una de les dues màquines de neteja i ha demanat paciència a la població i ha recordat que no va parar de nevar fins dilluns a la tarda i que s'han de netejar 70 quilòmetres de carrers amb dues persones. El centre sanitari fitxa un
"membre del Servei Meteorològic de Catalunya, a curt termini ""no s'aprecia un canvi de temps important"". Sí que podria nevar una mica al Pirineu, però sense acumular gruixos d'importància. La falta de pluja és evident en el paisatge de moltes","a desaparèixer, però aquesta setmana hi haurà més moments amb precipitacions. Dimecres a la tarda podria arribar a nevar puntualment per sota dels 500 metres, sobretot a la Catalunya Central, i entre divendres i dissabte a primera hora les"
"dies vinents, la novetat més gran de la setmana serà el pas d'un front, que entre dijous al vespre i divendres al matí farà nevar en alguns punts del Pirineu Occidental i pot arribar a deixar quatre gotes en altres comarques del nord. Farà que",que si plantegen una proposta perquè la Generalitat s'oblidi del referèndum és que no han entès res. Demà pot nevar en poblacions situades a 300 metres Demà pot nevar en punts de les comarques de Girona situats a només 300 metres d'
"últimes dades disponibles revelen que a l'Ebre durant els últims 100 anys ha disminuït el nombre de dies en què s'ha vist nevar , a l'Observatori Fabra la tendència no és clara. Val a dir, però, que al Tibidabo l'any amb més nevades és recent: el 2010",Generalitat s'oblidi del referèndum és que no han entès res. Demà pot nevar en poblacions situades a 300 metres Demà pot nevar en punts de les comarques de Girona situats a només 300 metres d'alçada. Una situació que arriba després de cinc dies de
"en general avui farà sol. Demà arribaran més bandes de núvols prims, a l'espera que dimecres ens creuï un front que farà nevar al nord del Pirineu, i que podria arribar a deixar xàfecs puntuals en algunes comarques de l'est. És probable que aquest","latituds més altes, afectarà Catalunya aquest dimecres. A banda, de la baixada de les temperatures es preveu que pugui nevar fora del Pirineu. La cota de neu se situarà als 400 metres al Prepirineu i també s ́estendrà amb el pas de les hores a altres"
"del Món. ""Som optimistes, no patim per la suspensió de la prova"", ha manifestat, tot i que mai es pot descartar res: ""pot nevar , pot fer vent i es pot suspendre per un altre motiu"", ha conclòs. Martí afirma que encara estudia la possible ubicació de","els 300 i els 500 metres, per tant en capitals de comarca com Solsona, Berga, Vic i Ripoll és molt probable que s'hi veig nevar durant el dia d'avui. També en punts alts del Vallès, Baix Llobregat, Penedès o fins i tot a Collserola probablement si"
"des de l'aeroport de la Seu, tenim la llebre palplantada al bell mig de la plaça del Poble, com a miroia. Ja que no vol nevar , com a mínim que saltin llebres. Per cert, les que van saltar amb les altres propostes de volar o intencions anunciades,","Casals ha afegit que no només afectarà l'oest de la Península, sinó que s'anirà desplaçant cap a l'est, de manera que pot nevar a Sierra Nevada i en alguna zona més àmplia, perquè la cota estarà entre 1.200 i 1.500. És a dir, que també afectarà el"
"sòlides arran de mar. La neu, en canvi, va ser molt més abundant i va caure de forma força continuada a les Balears. Va nevar amb ganes a Palma i a Lluc, però també va arribar a emblanquinar Eivissa i Formentera. El mes de gener havia estat","a la Garrotxa. En aquest darrer municipi ja s ́hi acumulen dos centímetres de neu. Aquesta matí i migdia també s ́ha vist nevar de forma feble a Manresa, Cardona o Vic i també ha caigut algun ruixat de calabruix a cotes molt baixes, per exemple a la"
"facilitarà la feina: ""en principi la neu ha de ser bastant dura. Són llocs on passen trineus o motos de neu. Si no acaba de nevar , no hauré d'obrir traça"". Pau Bartoló afirma que no té cap pressió per finalitzar els 146 km que separen la regió noruega","més afectades són la Garrotxa i el Ripollès. A la C-16 la situació s'ha complicat perquè just abans que comencés a nevar un camió ha fet la tisora dins del túnel del Cadí i ha obligat a tallar la circulació mentre el retiraven. Amb tot, els"
"setmana. Dissabte la cota de neu se situarà per sobre dels 1500 metres, però diumenge baixarà en picat i a la tarda podrà nevar també al fons de les valls. El vent també serà un ingredient del temps del cap de setmana, entre demà a la tarda i dissabte","que tenia dues parades, una al MACBA i una altra al Liceu. No han pogut ni acabar-la perquè, quan han sabut que començava a nevar a Camprodon, han decidit interrompre la sortida per tornar cap a casa. Tot i la precaució, no ha pogut arribar perquè la"
"dies amb la força i determinació d'un autèntic campió: ""el primer dia va ser tot plovent i amb vent. Al segon ja ens va nevar . Cada passa que feia, no sabia a quina alçada m'enfonsaria, era molt lent avançar. Psicològicament va ser dur, dormia","Països Baixos i Alemanya. Alerten de més nevades al Ripollès i la Cerdanya aquest divendres Aquest divendres tornarà a nevar a les comarques de Cerdanya i el Ripollès. Així ho pronostica el Servei Meteorològic de Catalunya, que preveu que la"
". A cotes baixes la nevada només s'entreveu important al vessant nord, tot i que diumenge a última hora també podria nevar en punts baixos de la Ribagorça i de la Cerdanya. Dilluns el fort vent també podria fer saltar cap a algunes valls del","preveu que es reactivi l ́episodi de nevades, que seran abundants al Pirineu i es podran acumular gruixos a zones on ja va nevar ahir del Ripollès, Berguedà o Cerdanya. Segons el Servei català de Trànsit, en aquests moments només hi ha tallada la"
"Demà el temps no canviarà, però dijous arribarà un nou front que tornarà a fer augmentar els núvols. És probable que faci nevar al Pirineu i que pugui deixar també lleugeres emblanquinades al Prepirineu i als Ports de Beseit. No s'esperen","als túnels de Sant Esteve d'en Bas. A la resta de la comarca, la nevada no va provocar afectacions perquè hi va nevar poc o, com a Olot, els serveis de la neteja municipal van treballar tota la nit. Al Ripollès el transport escolar va"
"el cap de setmana amb un diumenge força més càlid. Cal parar atenció demà a l'arribada d'una borrasca que pot fer nevar en indrets on la neu hi és poc habitual. Al matí les nevades afectaran les cotes baixes de molts punts del Pirineu,","era que a mesura que avancés el dia pujaria fins als 1.200 metres, i ho va fer. Al voltant de les sis de la tarda va tornar a nevar a Molló i a Setcases. Són pobles situats a una altitud superior als 1.200 metres. Per sota dels 1.000 metres va ploure tot"
"i les Terres de l'Ebre durant el matí. La cota de neu serà baixa, rondarà al voltant dels 800 metres, fet que farà que pugui nevar a les cotes baixes del Pirineu i també als Ports de Beseit. Algunes gotes o volves de neu també es podrien escapar en punts","farà desplomar també la cota de neu fins al fons de les valls a partir de la tarda. Caldrà present que demà podria tornar a nevar en localitats com Andorra la Vella, Esterri d'Àneu, Viella, el Pont de Suert o Puigcerdà, entre d'altres. Els mapes"
"de matinada situat als extrems nord i sud del país però anirà evolucionant al llarg del dia i s'espera que a la tarda pugui nevar a la major part del territori, a excepció de la franja litoral de la meitat nord i d'alguna comarca interior. Al Pirineu i","sobre immigració, encara que ja s'havien generat tot tipus de burles sobre l'ocorregut ""anit a Suècia"". ""És per què va nevar ?"", ""Per què un grup gran de rens va creuar la frontera?"" o ""Què s'ha fumat?"" han estat alguns dels comentaris publicats"
", la probabilitat que s'acumulin més de 5 centímetres per sobre dels 600 metres és molt alta (4 sobre 6). També pot nevar , però amb menys probabilitat, a la resta de comarques de la Catalunya Central, interior de Barcelona, Lleida i el terç","decidir.' Amb el pla Ibarretxe, doncs, el poble basc va arribar al camp 2, però llavors van sorgir els contratemps. 'Va nevar molt, vam tenir molts problemes i vam haver de tornar al campament base', ha explicat. 'Però del camp 2 va sortir-ne una"
"pugui fitxar"". El Fuenlabrada no venç al Bou Congost des del 2006 i hi ha perdut en les seves darreres vuit visites. 'Pot nevar , i pot nevar molt' FALSET | ACN El conseller d'Interior, Jordi Jané, ha avançat que aquest dissabte es podran produir",", però això és impossible, completament una utopia. Dir que les fires haurien de desaparèixer és com dir que hauria de nevar més a València. Una cosa és el que desitgem i una altra la realitat. I en este moment tot gira al voltant de les fires."
"limitat el refredament nocturn#meteocat pic.twitter.com/hhNXVj69xr -- Meteocat (@meteocat) S'espera que pugui nevar a qualsevol punt, encara que les nevades seran més copioses per damunt dels 600 metres, i la cota de neu quedarà a l'","de neu, uns 40 cm per sota de la mitjana. Les previsions a curt i mitjà termini anuncien que de cara a dimarts podrà tornar a nevar a cotes mitjanes i altes del Pirineu de forma feble. Dissabte, coincidint amb el pas d'una pertorbació activa, les"
"que s'acumulin més de cinc centímetres per sobre dels 700 metres era ahir molt alta, mentre que també podria nevar , amb menys probabilitat, a la resta de comarques de la Catalunya Central, al terç sud del país, i en altres comarques de",". Diumenge encara arribarà un tercer front, en aquest cas menys actiu, entre diumenge a la tarda i dilluns és quan podria nevar amb una mica més de ganes al Pirineu. Durant tot el cap de setmana l a cota de neu rondarà en general entre els 1000 i els 1500"
"després d'un febrer cosí germà del gener..., sense gairebé ni piular. Quina fam de neu tenen les muntanyes i de veure nevar tenim nosaltres. Aquesta nit ho ha fet i avui dissabte l'hivern s'entaula a la casa pairal andorrana. Neva que nevaràs.","del temps fan pensar que dissabte s'arribarà a situar per sota dels 1000 metres, de manera que al Pirineu pot arribar a nevar fins i tot al fons d'algunes valls. Diumenge arribarà un tercer front, aquest encara menys actiu. Deixarà algunes"
", s'ubicava encara a l voltant dels 1000 m al Pirineu, sobretot al sector oriental. Tot just a primeres hores començava a nevar a Planoles o queia aiguaneu a Puigcerdà (1200 m) Aquests són alguns dels gruixos acumulats fins a dos quarts del matí: La","aquest divendres i dissabte, quan les nevades cauran en cotes baixes del nord-oest de la Península, de manera que ""pot"" nevar en capitals de província com Lleó, Palència, Burgos, Sòria i Àvila, encara que no espera que en aquestes localitats se"
"de Catalunya la neu pot tornar a fer acte de presència a cotes de només 300 metres. Mentre que a la resta del país també pot nevar en cotes a partir dels 500"", ha conclòs Jané. Més de 300 esportistes gais de tot Europa es donen cita a València La ciutat","comarques del nord i en punts de l'Ebre. Diumenge al migdia un tercer front mantindrà el cel enterbolit i encara farà nevar més puntualment al Pirineu. Atents a la cota de neu, perquè durant la pròxima nit baixarà fins a situar-se a prop dels"
continuen mobilitzats diversos camions llevaneus per assistir els afectats en cas que sigui necessari. Pot nevar amb una temperatura superior als 0oC? Intuïtivament solem pensar que la neu només cau quan el termòmetre marca zero,"a prop dels 1000 metres, o fins i tot puntualment per sota. Per tant demà al Pirineu i Prepirineu hi podria arribar a nevar fins al fons d'algunes valls. La nevada es preveu abundant a partir dels 1500 metres, fins al punt que el Meteocat té"
"lluny de la realitat, tal i com estem comprovant aquest cap de setmana en alguns indrets del país. En realitat per veure nevar no és imprescindible que el mercuri marqui 0oC, ja que ho pot fer en alguns casos amb temperatures de fins a 3oC. En el cas","van trobar amb un problema de drenatge, però el van posar en servei. A l'hivern, quan feien el camp de futbol petit, els va nevar i ploure i el camp va quedar enfangat. Ara ja hi posen gespa i, quan estiguin, solucionaran el drenatge del camp de la"
"de 10oC tal i com va passar ara fa un parell de setmanes a la comarca del Maresme. El nivell a partir del qual es veu nevar està en funció de l'altitud a la qual s'emplaça la isozero, es a dir, la isoterma dels zero graus. Sovint podem veure","començarà amb més núvols prims, però com a mínim fins dimecres no arribarà una borrasca més activa que pugui fer ploure i nevar en diverses comarques. És possible que aquest canvi de temps vagi acompanyat d'una baixada de temperatura destacable"
"està en funció de l'altitud a la qual s'emplaça la isozero, es a dir, la isoterma dels zero graus. Sovint podem veure nevar algunes desenes, o uns pocs centenars, de metres més avall de l'altura a la qual el mercuri marqui zero graus. Si l'aire","la nevada serà a cotes força més baixes que a l'Oriental. Als Ports i en punts de l'altiplà central podria arribar nevar fins als 700 o 800 metres la nit de divendres a dissabte, tot i que gran part de les precipitacions seran en forma d'aigua."
", intensa i els flocs són relativament grans, es produiran fàcilment desplomaments d'aire fred i es podrà veure nevar força més avall. En aquest supòsit, a més, els flocs aguantaran molt més la fusió que no pas si la nevada és feble, o bé si","baixa, però encara quedaran alguns ruixats entre el nord de Ponent, de la Catalunya Central i el Pirineu, on encara pot nevar a cotes baixes. A partir del migdia, la cota començarà a pujar cap als 800 i 1.000 metres progressivament, i durant la"
"la nevada és feble, o bé si són de modestes dimensions. Finalment, cal evitar confondre la cota a partir de la qual es veu nevar , amb la cota a partir de la qual la neu agafa al terra. La neu només agafarà si la temperatura ambiental es troba per sota o","no serà tan marcat com el cap de setmana passat. A la Vall d'Aran i al nord del Pallars dissabte al vespre hi arribarà a nevar per sota dels 1000 metres, però en general les precipitacions deixaran neu al voltant o per sobre dels 1500. Un jutge"
"es troba per sota o al voltant dels zero graus, si el sòl ja tenia neu prèviament, o bé si està glaçat. És per això que veure nevar , encara que sigui durant moltes hores, no implica necessàriament que la neu acabi agafant damunt del terra. Un tornado","centre i sud del país que no pas al nord-est. Com a cas extrem, al llarg de la nit i primeres hores de la matinada va arribar a nevar fins a cotes de 200 o 300 m del pla de Lleida i del prelitoral, al mateix moment en què al Pirineu oriental la cota de neu es"
"de la comarca i refugis com, per exemple, el del xalet dels Rasos de Peguera. A Berga i poblacions de l'entorn no hi va nevar malgrat que les previsions del temps havien alertat d'aquesta possibilitat. En altres punts de la regió central,","que les màximes baixin avui al centre i al nord del país, i es preveu que el cel serà tapat. Segons les previsions, demà pot nevar en zones de l'interior amb una cota que oscil·larà entre 900 metres i 1200. La baixada de la temperatura serà general."
", ha dit, al 90%. En qualsevol cas, ha insistit que les freqüències diàries actuals són insuficients. Comença a nevar al Ripollès i a la Cerdanya Comença a nevar en diversos punts de les comarques de Girona. Ho fa a la Cerdanya i al Ripollès i","fins a les 8 del matí desataquen: Són pocs els indrets que han recollit menys de 5 l/m2. Aquesta tarda deixarà de ploure i nevar , s'obriran clarianes, i això provocarà que la pròxima nit sigui la més freda de la setmana. El termòmetre baixarà sota"
"novembre. La neu continuarà caient al Pirineu durant els dies vinents. Demà s'espera que al llarg de la tarda comenci a nevar per sobre dels 2.200 metres, amb una tendència a la baixa de la cota de neu. Durant la nit i la matinada, quan la nevada s'","i ha acumulat un gruix de dos centímetres. Des del Servei Meteorològic de Catalunya han informat que també s'ha vist nevar a Olot però que, en aquest cas, no ha arribat a prendre. Vila afirma que la ""sobredosi ideològica"" amenaça amb frenar el"
"amb 654 productors. Coll ha afirmat que les perspectives per a la temporada que ve són positives perquè ja ha començat a nevar , i ha indicat que la venda de forfets de temporada i les reserves estan a nivells superiors respecte a l'any passat en el","va deixar gruixos destacats en diverses poblacions: a Puigcerdà es van arribar a acumular 20 centímetres i també va nevar a Gombrèn, on es va registrar un gruix d'un centímetre i a Molló, on ja el terra es va tenyir amb una fina capa de neu. També"